Place,District,Category,Best_Month,Description,Image,Short_Description,Latitude,Longitude

Aihole,Bagalkot,Heritage,January,Ancient temple architecture,https://assets.architecturaldigest.in/photos/644ea2725e459f60aa9509b3/master/w_1600%2Cc_limit/cave-temple-aihole.jpg,Aihole is a historic town located in the Bagalkot district of Karnataka. It is known for its ancient temple architecture with over 125 temples dating back to the 5th century. The temples at Aihole are renowned for their intricate carvings and unique architectural styles making it a significant destination for history enthusiasts and those interested in ancient Indian art and culture.,16.02679,75.883537
Almatti Dam,Bagalkot,Dam,May,Famous reservoir,https://encrypted-tbn0.gstatic.com/images?q=tbn:ANd9GcREEDmJ8eBZe1tIouBDHApgd-qt_4AgutTUwA&s,Almatti Dam is a picturesque reservoir located in the Bagalkot district of Karnataka. It is built across the Krishna River and offers a tranquil environment for visitors to relax and enjoy nature. The dam is surrounded by lush greenery and provides opportunities for boating and picnicking making it a popular destination for families and nature enthusiasts visiting the region.16.,16.331190226431385, 75.88820969970962
Archaeological Museum Badami,Bagalkot,Historical,December,Historic artifacts museum,https://jinkchak.wordpress.com/wp-content/uploads/2011/08/img_0285_1.jpg,The Archaeological Museum in Badami is a significant destination for history enthusiasts and those interested in exploring Karnataka's rich cultural heritage. The museum houses a collection of historic artifacts and exhibits that provide insights into the region's past including ancient sculptures inscriptions and other archaeological findings. Visitors can learn about the history and culture of Bagalkot and the surrounding areas through the various displays and exhibits in the museum making it a must-visit spot for tourists exploring the region.,15.921519189405151, 75.68511879268108
Badami,Bagalkot,Heritage,November,Cave temples,https://encrypted-tbn0.gstatic.com/images?q=tbn:ANd9GcSh6oqBjEdDlVOcdm6pD0ex1Js-zUDJEVDpIw&s,Badami is a historic town located in the Bagalkot district of Karnataka. It is renowned for its ancient cave temples carved into sandstone cliffs which date back to the 6th century. The temples feature intricate carvings and sculptures depicting Hindu deities and mythological scenes making Badami a significant destination for history enthusiasts and those interested in ancient Indian architecture.,15.9216682,75.6778945
Badami Fort,Bagalkot,Forts,October,Hilltop fort,https://avathioutdoors.gumlet.io/live/1024px-Badami_fort_viewed_from_cave_shelters_5565.jpg?q=80&upscale=true&w=680&h=680&format=webp&compress=true,Badami Fort is a historic hilltop fort located in the Bagalkot district of Karnataka. It is known for its impressive architecture and historical significance as it has witnessed several battles and rulers over the centuries. The fort offers stunning views of the surrounding landscape and is a popular destination for history enthusiasts looking to explore the rich cultural heritage of Karnataka.,15.921882349060711, 75.68484244127274
Banashankari Temple,Bagalkot,Pilgrimage,February,Famous temple,https://encrypted-tbn0.gstatic.com/images?q=tbn:ANd9GcQvD8E0PMZPXI4sGRlAVI4-jUHnCft1HgBxhw&s,Banashankari Temple is a renowned pilgrimage site located in the Bagalkot district of Karnataka. It is dedicated to Goddess Banashankari an incarnation of Goddess Parvati. The temple is known for its vibrant festivals and spiritual significance attracting devotees from across the region. Banashankari Temple offers a serene environment for worship and is a popular destination for those seeking spiritual solace in Karnataka.,15.887588303541106, 75.7045565898312
Bhuthanatha Temple,Bagalkot,Historical,November,Lakeside temple,https://upload.wikimedia.org/wikipedia/commons/c/c1/Bhutanatha_temple_in_Badami%2C_Karnataka%2C_India.jpg,Bhuthanatha Temple is a historic lakeside temple located in the Bagalkot district of Karnataka. It is known for its architectural beauty and historical significance as it dates back to the 6th century. The temple is dedicated to Lord Bhuthanatha and features intricate carvings and sculptures that depict various mythological stories making it a significant destination for history enthusiasts and those interested in exploring Karnataka's rich cultural heritage. Bhuthanatha Temple offers visitors a glimpse into the region's past and is a popular spot for those looking to experience the historical landmarks of Bagalkot.,15.92080923459426, 75.68833978012707
Ilkal,Bagalkot,Textile,March,Traditional saree weaving,https://encrypted-tbn0.gstatic.com/images?q=tbn:ANd9GcTRObvcEZC7fMdCwsFfWtiKiSYkRPPSWP-maw&s,Ilkal Saree is a traditional saree weaving style that originates from the Bagalkot district of Karnataka. It is known for its unique patterns and vibrant colors making it a popular choice among saree enthusiasts. The sarees are handwoven using cotton and silk threads and often feature intricate designs inspired by local culture and traditions. Ilkal Saree is a significant cultural symbol of Karnataka and is cherished for its craftsmanship and artistic value.,15.9505774,76.1095554
Kudalasangama,Bagalkot,Pilgrimage,April,Basavanna memorial,https://s7ap1.scene7.com/is/image/incredibleindia/1-kudala-sangama-bijapur-karnataka-attr-hero?qlt=82&ts=1727415004780,Kudalasangama is a revered pilgrimage site located in the Bagalkot district of Karnataka. It is the confluence of the rivers Krishna and Malaprabha and is known for the memorial of Basavanna a 12th-century philosopher and social reformer. The site attracts devotees and tourists alike who come to pay their respects and enjoy the serene environment created by the meeting of the two rivers.,16.1996094,76.048277
Mahakuta,Bagalkot,Historical,March,Temple complex,https://encrypted-tbn0.gstatic.com/images?q=tbn:ANd9GcSrQ8XdfMBvPQkW_OU8NlELH6HGC0GVkCYC4Q&s,Mahakuta is a historic temple complex located in the Bagalkot district of Karnataka. It is known for its ancient temples dedicated to Lord Shiva which date back to the 6th century. The temples at Mahakuta are renowned for their intricate carvings and architectural brilliance making it a significant destination for history enthusiasts and those interested in ancient Indian culture and spirituality.,15.93341557046465, 75.72244883499275
Pattadakal,Bagalkot,Heritage,December,UNESCO temple complex,https://encrypted-tbn0.gstatic.com/images?q=tbn:ANd9GcTXulD4sXLMwCsqq4gDRi3_Tn_tK4bZqaDqkw&s,Pattadakal is a UNESCO World Heritage Site located in the Bagalkot district of Karnataka. It is known for its stunning temple complex that showcases a blend of Dravidian and Nagara architectural styles. The temples at Pattadakal are adorned with intricate carvings and sculptures depicting various Hindu deities and mythological stories. This historic site attracts visitors from around the world who come to admire its architectural brilliance and cultural significance.,15.957021167422898, 75.80010032293958

Ballari Fort,Ballari,Forts,June,Historic hill fort,https://justallmovies.wordpress.com/wp-content/uploads/2018/07/07-bellary-fort.jpg,Bellary Fort is a historic hill fort located in the Ballari district of Karnataka. It is known for its impressive architecture and strategic location offering panoramic views of the surrounding landscape. The fort has a rich history and has witnessed several battles and rulers over the centuries making it a significant destination for history enthusiasts looking to explore the cultural heritage of Karnataka.,15.1486711,76.9104097
Ballari Zoo,Ballari,Wildlife,November,Local zoo,https://www.hlimg.com/images/things2do/738X538/ttd_201812021116091543729569203243t.jpg,Ballari Zoo is a local zoo located in the Ballari district of Karnataka. It is home to a variety of animals and birds providing an opportunity for visitors to learn about the region's wildlife. The zoo offers a family-friendly environment and is a popular destination for those looking to experience the natural diversity of Karnataka's fauna.,15.1446995,76.9037958
Daroji Bear Sanctuary,Ballari,Wildlife,August,Sloth bear sanctuary,https://hblimg.mmtcdn.com/content/hubble/img/hampi/mmt/activities/m_activities_hampi_daroji_sloth_bear_sanctuary_l_400_640.jpg,Daroji Bear Sanctuary is a protected wildlife sanctuary located in the Ballari district of Karnataka. It is known for its population of sloth bears and offers visitors a unique opportunity to observe these fascinating creatures in their natural habitat. The sanctuary also features diverse flora and fauna making it a popular destination for wildlife enthusiasts and nature lovers visiting the region.,15.2599171,76.5799537
Donimalai,Ballari,Mining,September,Iron ore mining area,https://pbs.twimg.com/media/Ef1l9wrVoAA-imA.jpg,Donimalai is a region located in the Ballari district of Karnataka known for its iron ore mining activities. It is also surrounded by natural beauty with lush greenery and scenic landscapes making it a unique destination for those interested in both industrial heritage and nature. Visitors can learn about the mining industry while also enjoying the serene environment of the area.,15.060275,76.5915129
Kumaraswamy Temple,Ballari,Pilgrimage,May,Famous temple,https://dynamic-media-cdn.tripadvisor.com/media/photo-o/08/70/04/76/kumaraswamy-temple.jpg?w=1200&h=-1&s=1,The Kumaraswamy Temple in Sandur Ballari district Karnataka India is an ancient Hindu temple complex dedicated to Lord Murugan (also known as Kartikeya or Kumaraswamy) It is among the oldest Murugan shrines in the region and holds significant cultural and historical value for South Indian Shaivite and Subrahmanya worship traditions.,15.1536035,76.9137276
Narihalla Reservoir,Ballari,Dam,October,Scenic reservoir,https://encrypted-tbn0.gstatic.com/images?q=tbn:ANd9GcTmGs7iSwWTGMgyl-Y8IOVmUFxX2vICBjFX9Q&s,Narihalla Reservoir is a scenic water body located in the Ballari district of Karnataka. It is known for its tranquil environment and beautiful surroundings making it a popular destination for nature lovers and those looking to experience the natural beauty of the region. The reservoir offers opportunities for boating and picnicking providing a perfect setting for relaxation and enjoying nature in Karnataka.,15.128292081871145, 76.60056014432209
Sandur,Ballari,Nature,July,Scenic valley,https://jlrexplore.com/wp-content/uploads/2015/09/Sandur1.jpg,Sandur is a scenic valley located in the Ballari district of Karnataka. It is known for its lush greenery rolling hills and serene environment making it a popular destination for nature lovers and those looking to experience the tranquility of the region. Sandur offers opportunities for trekking and exploring the beautiful landscapes of Karnataka's countryside.,15.0832754,76.543411
Toranagallu JSW,Ballari,Industrial,April,Steel plant area,https://encrypted-tbn0.gstatic.com/images?q=tbn:ANd9GcSYTxo_j6WZKWfkR6ELO3tSxBH7f20BAuKu9g&s,Toranagallu JSW is an industrial area located in the Ballari district of Karnataka. It is known for its steel plant and industrial activities contributing to the region's economy. While it may not be a traditional tourist destination it offers insights into the industrial landscape of Karnataka and can be of interest to those looking to explore the economic aspects of the region.,15.196396776434293, 76.67512356552145

Belgaum Fort,Belagavi,Forts,February,Historic fort,https://encrypted-tbn0.gstatic.com/images?q=tbn:ANd9GcRWRake1oPEXkXEemNznKGEOb8Bizf7LuwSxQ&s,Belgaum Fort is a historic fort located in the Belagavi district of Karnataka. It is known for its impressive architecture and historical significance as it has witnessed several battles and rulers over the centuries. The fort offers stunning views of the surrounding landscape and is a popular destination for history enthusiasts looking to explore the rich cultural heritage of Karnataka.,15.8583942,74.5241576
Bhimgad Sanctuary,Belagavi,Wildlife,November,Wildlife forest area,https://images.indianexpress.com/2021/10/bhimgad-wildlife-sanctuary.jpg?w=1200,Bhimgad Sanctuary is a protected wildlife sanctuary located in the Belagavi district of Karnataka. It is known for its diverse flora and fauna as well as its dense forest area that provides a habitat for various species of animals and birds. The sanctuary offers opportunities for trekking and wildlife observation making it a popular destination for nature lovers and adventure enthusiasts looking to explore the natural beauty of Karnataka's forests.,15.565098078236803, 74.33598853872408
Godchinamalaki Falls,Belagavi,Waterfall,May,Popular falls,https://encrypted-tbn0.gstatic.com/images?q=tbn:ANd9GcTrt-VgdlsmHNuMIroF-McmdqJQ5Ffaoj-1-w&s,Godchinamalaki Falls is a popular waterfall located in the Belagavi district of Karnataka. It is known for its stunning beauty and serene surroundings making it a favorite destination for nature lovers and photographers. The falls are especially impressive during the monsoon season when the water flow is at its peak creating a mesmerizing sight for visitors. Godchinamalaki Falls offers a tranquil environment for visitors to enjoy nature and capture the beauty of this natural wonder.,16.12325341490706, 74.74993585558708
Gokak Falls,Belagavi,Waterfall,March,Scenic waterfall,https://thrilltourism.com/storage/4738/byo3NdGitrg4uGm6ZxIVuTQUEaJocgEJFz0Twg3M.jpg,Gokak Falls is a scenic waterfall located in the Belagavi district of Karnataka. It is known for its stunning beauty and serene surroundings making it a favorite destination for nature lovers and photographers. The falls are especially impressive during the monsoon season when the water flow is at its peak creating a mesmerizing sight for visitors. Gokak Falls offers a tranquil environment for visitors to enjoy nature and capture the beauty of this natural wonder.,16.1923761,74.7769884
Jamboti Hills,Belagavi,Hill Station,April,Scenic hill station,https://tripxl.com/blog/wp-content/uploads/2025/08/Jamboti-Hills.jpg,Jamboti Hills is a scenic hill station located in the Belagavi district of Karnataka. It is known for its lush greenery serene environment and beautiful landscapes making it a popular destination for nature lovers and those looking to escape the hustle and bustle of city life. The hill station offers opportunities for trekking and exploring the beautiful surroundings of Karnataka's hills providing a perfect setting for relaxation and connecting with nature.,15.691561399648966, 74.36736004569464
Kapileshwar Temple,Belagavi,Pilgrimage,June,Famous temple,https://avathioutdoors.gumlet.io/travelGuide/dev/belgaum_P1611.jpg,Kapileshwar Temple is a famous temple located in the Belagavi district of Karnataka. It is dedicated to Lord Shiva and is known for its religious significance and architectural beauty. The temple attracts devotees and tourists alike who come to admire the intricate carvings and experience the spiritual ambiance of this unique destination. Kapileshwar Temple offers a serene environment for worship and is a popular spot for those seeking spiritual solace in Karnataka.,15.855438066745805, 74.51949783021477
Kamal Basadi,Belagavi,Historical,September,Ancient Jain temple,https://encrypted-tbn0.gstatic.com/images?q=tbn:ANd9GcTYNIHZ9K-i4ptCyDrcpzrE22mMlUlfEM3Z4Q&s,Kamal Basadi is an ancient Jain temple located in the Belagavi district of Karnataka. It is known for its stunning architecture and intricate carvings that showcase the artistic brilliance of the Jain culture. The temple is a significant destination for history enthusiasts and those interested in exploring Karnataka's rich cultural heritage. Kamal Basadi offers visitors a glimpse into the region's past and is a popular spot for those looking to experience the historical landmarks of Belagavi.,15.858280533233286, 74.52259874981434
Kittur Fort,Belagavi,Forts,April,Rani Chennamma fort,https://s7ap1.scene7.com/is/image/incredibleindia/2-kittur-fort-and-palace-belgaum-karnataka-attr-hero?qlt=82&ts=1726717492478,Kittur Fort is a historic fort located in the Belagavi district of Karnataka. It is known for its association with Rani Chennamma a brave queen who fought against British colonial rule in the 19th century. The fort offers stunning views of the surrounding landscape and is a popular destination for history enthusiasts looking to explore the rich cultural heritage of Karnataka.,15.601401636746502, 74.79208285221762
Navilutheertha Dam,Belagavi,Dam,May,Scenic dam,https://belagavitourism.com/wp-content/uploads/2024/09/page1_image1_crop_0.webp,Navilutheertha Dam is a scenic dam located in the Belagavi district of Karnataka. It is known for its tranquil environment and beautiful surroundings making it a popular destination for nature lovers and those looking to experience the natural beauty of the region. The dam offers opportunities for boating and picnicking providing a perfect setting for relaxation and enjoying nature in Karnataka.,15.821573868576591, 75.09647862807097
Nersa,Belagavi,Nature,July,Forest village,https://encrypted-tbn0.gstatic.com/images?q=tbn:ANd9GcRUu0JOiFEXP0m2U1327oDpElCpI1GQAyXsaA&s,Nersa is a serene forest village located in the Belagavi district of Karnataka. It is known for its lush greenery and tranquil environment making it a popular destination for nature lovers and those looking to experience the beauty of the region's forests. Nersa offers opportunities for trekking and exploring the diverse flora and fauna of Karnataka's natural landscapes providing a refreshing escape for visitors seeking a connection with nature.,15.601680837140895, 74.42978022216316
Parasgad Fort,Belagavi,Forts,September,Fort trekking spot,https://belagavitourism.com/wp-content/uploads/2024/09/page1_image1_crop_5-1.webp,Parasgad Fort is a popular trekking destination located in the Belagavi district of Karnataka. It is known for its scenic beauty and historical significance as it dates back to the 16th century. The trek to Parasgad Fort offers stunning views of the surrounding landscape and provides a refreshing experience for nature lovers and adventure enthusiasts looking to explore the natural beauty of Karnataka's hills while immersing themselves in the region's rich history.,15.739698290417392, 75.12980778474986
Ramdurg Fort,Belagavi,Forts,August,Historic fort,https://encrypted-tbn0.gstatic.com/images?q=tbn:ANd9GcR6w0c1_f9JejboKPj1plH2gfsBU4oQRBpd4g&s,Ramdurg Fort is a historic fort located in the Belagavi district of Karnataka. It is known for its impressive architecture and historical significance as it has witnessed several battles and rulers over the centuries. The fort offers stunning views of the surrounding landscape and is a popular destination for history enthusiasts looking to explore the rich cultural heritage of Karnataka.,15.94822992246721, 75.29278382892728
Yellamma Gudda,Belagavi,Pilgrimage,October,Hill temple,https://i.ytimg.com/vi/W9FTN5nNerA/maxresdefault.jpg,Yellamma Gudda is a significant pilgrimage site located in the Belagavi district of Karnataka. It is known for its hill temple dedicated to Goddess Yellamma and attracts devotees from across the region who come to seek blessings and experience the spiritual ambiance of this unique destination. The temple is situated on a hill offering stunning views of the surrounding landscape making it a popular spot for those looking to combine spirituality with natural beauty in Karnataka.,15.754795074576554, 75.15478847920271

Devanahalli Fort,Bengaluru Rural,Forts,February,Historic fort,https://s7ap1.scene7.com/is/image/incredibleindia/devanahalli-fort-bangaluru-karnataka-6-musthead-hero?qlt=82&ts=1742197682256,Devanahalli Fort is a historic fort located in the Bengaluru Rural district of Karnataka. It is known for its impressive architecture and historical significance as it has witnessed several battles and rulers over the centuries. The fort offers stunning views of the surrounding landscape and is a popular destination for history enthusiasts looking to explore the rich cultural heritage of Karnataka.,13.249845851232283, 77.70943366145953
Dodda Alada Mara,Bengaluru Rural,Nature,March,Big banyan tree,https://images.openai.com/static-rsc-4/1rtgTq4OOpsyf9b__4Je3gxi3Im6goSG3qxIddFe9s3WK_x8hkmqu2a8Yzs9wloqVRuELkOFdIoIGVAmGaJ57zdxlhSNr9t-9_4yH1Q1D9tDcI-HyEZ10GVIF7oxVc_7Xi3isvCcx1-x6ZYbSakQP4fsIUY-tQrt63eK3YNz423KXQgmz_80FX9AiDmkHVx5?purpose=fullsize,Dodda Alada Mara also known as the Big Banyan Tree is a famous natural attraction located in the Bengaluru Rural district of Karnataka. It is known for its sprawling canopy and intricate root system making it a unique destination for nature lovers and those looking to experience the beauty of Karnataka's natural wonders. The tree provides a serene environment for visitors to relax and enjoy the tranquility of nature while exploring the fascinating structure of this ancient banyan tree.,12.909718068327516, 77.39658098659825
Grover Zampa Vineyards,Bengaluru Rural,Industrial,April,Vineyard and winery,https://images.openai.com/static-rsc-4/TleQKomnodZknP1AmKh7AkApmLBvk3YVlN8q4XAIfvMLPoOmKn5bx-lX42ffTVhP2MxcXmmlwAhxqwfPwPhp7hZpBxS2X5P7UrRzeVY2sZfdW4VieZBh6rlmfwzve_p9Wc5HUaNhrKMB2KvB4l9h7xgWO6fmcw0jfJQ7F6Xqv5mA88TTZsn6dtTLaOfDzwbR?purpose=fullsize,Grover Zampa Vineyards is a renowned vineyard and winery located in the Bengaluru Rural district of Karnataka. It is known for its picturesque landscapes and the production of high-quality wines. Visitors can take guided tours of the vineyard learn about the winemaking process and enjoy wine tastings in a serene environment surrounded by lush greenery. Grover Zampa Vineyards offers a unique experience for wine enthusiasts and those looking to explore the natural beauty of Karnataka's countryside.,13.28735078973186, 77.58346667131245
Makalidurga Hills,Bengaluru Rural,Hill Station,March,Scenic hill station,https://images.openai.com/static-rsc-4/f3zse7Pkgyum1oX7SOD8cCquEWa7_iF3EDCMLXn3-WccMDcKb8JiyOgArrfzyImmNZDCGtu2dkM2gMYm0XR03enfUW_zilHeaC_6hjVqeidiwoRvdjRRdp90_rtneiSdi88-YFMlnsGr6ol9yhkddA3uVbnFbVZfR3NIe4BqNlHMWl61e2Rk3vFmiLuKTjn5?purpose=fullsize,Makalidurga Hills is a scenic hill station located in the Bengaluru Rural district of Karnataka. It is known for its lush greenery serene environment and beautiful landscapes making it a popular destination for nature lovers and those looking to escape the hustle and bustle of city life. The hill station offers opportunities for trekking and exploring the beautiful surroundings of Karnataka's hills providing a perfect setting for relaxation and connecting with nature.,13.4337059293744, 77.50321038659825
Nrityagram,Bengaluru Rural,Cultural,May,Dance village,https://images.openai.com/static-rsc-4/Qhill-09oTKXqbYbOMRh2Fnl36uegdGyHmrBpeLDhp8uR_as8UB1bhxg8xz2FuUDeGtzidsKT50JSPFjuBR7LsYtdkl3aLXoEP4ApMgsvpm7wQylrFGWe5vUHTfSBkKu7_jpNWpSpTgPcInosSpH9svD7RvqL0iK3y1RR8kFng4OcbZsFL6Fm3vIfbGCg14f?purpose=fullsize,Nrityagram is a unique cultural destination located in the Bengaluru Rural district of Karnataka. It is a dance village dedicated to the preservation and promotion of Indian classical dance forms. Visitors can witness captivating dance performances and learn about the rich cultural heritage of Karnataka through the various dance styles showcased at Nrityagram. The village offers a serene environment for art enthusiasts and those interested in exploring the vibrant cultural scene of Karnataka.,13.161852393025205, 77.46006263687573

Bangalore Palace,Bengaluru Urban,Historical,September,Royal palace,https://karnatakatourism.org/_next/image/?url=https%3A%2F%2Fweb-cms.karnatakatourism.org%2Fwp-content%2Fuploads%2F2025%2F07%2FBangalore-Palace_600-1280x720-1.jpg&w=3840&q=75,Bangalore Palace is a historic royal palace located in the heart of Bengaluru Urban district in Karnataka. It is known for its stunning architecture inspired by Tudor-style castles and its rich history as the residence of the Wodeyar royal family. The palace features beautiful interiors with ornate woodwork and lavish furnishings making it a popular destination for history enthusiasts and those interested in exploring the cultural heritage of Karnataka. Bangalore Palace offers visitors a glimpse into the opulent lifestyle of the past and is a must-visit spot for tourists exploring Bengaluru.,12.9985954,77.5920086
Bannerghatta National Park,Bengaluru Urban,Wildlife,February,Famous safari park,https://static.tripclap.com/uploads/places/850X450/bannerghatta-national-park_1632328335-9992e.jpg,Bannerghatta National Park is a famous wildlife sanctuary located in the Bengaluru Urban district of Karnataka. It is known for its diverse flora and fauna as well as its safari park where visitors can observe various animals including tigers lions elephants and bears in their natural habitat. The park also features a butterfly park and a zoo making it a popular destination for wildlife enthusiasts and families looking to experience the natural beauty of Karnataka.,12.532906,77.5461907
Big Bull Temple,Bengaluru Urban,Religious,March,Unique temple,https://images.openai.com/static-rsc-4/nBP9L0rCtBSe4imeKbypa_fH3zlfQX1ZFTg1mdRWrKQLTZJ1uftnTfF3ZfSXpZj5eKTJoDgt6hLZ4cOSdlLc-iBhLAyw5Kk2Kmz9J8EFi44BXrE-QqiMRZDoGlcG7xxd_HRS_ZQCYXFQLIkYkRi5EjazRbHwhT8z7cJrg9zlFPtCN3CkmqLlhD2QuL0hwmZj?purpose=fullsize,Big Bull Temple also known as Dodda Basavana Gudi is a unique temple located in the heart of Bengaluru Urban district in Karnataka. It is dedicated to Nandi the sacred bull and is known for its massive monolithic statue of Nandi which is one of the largest in the world. The temple attracts devotees and tourists alike who come to admire the impressive statue and experience the spiritual ambiance of this distinctive destination in Karnataka.,12.9421988006308, 77.5687514944289
