Place,District,Category,Best_Month,Description,Image,Short_Description,Latitude,Longitude
Ikkeri,Shivamogga,Historical,May,Temple architecture,https://dynamic-media-cdn.tripadvisor.com/media/photo-o/0d/af/2e/f2/ikkeri-aghoreshvara-temple.jpg?w=1200&h=1200&s=1,Ikkeri is a historic town located in the Shivamogga district of Karnataka. It is known for its unique temple architecture and rich cultural heritage. The town features several ancient temples including the Aghoreshwara Temple and the Shakti Temple which are renowned for their intricate carvings and architectural brilliance. Ikkeri offers visitors a glimpse into the region's history and is a popular destination for those interested in exploring Karnataka's cultural landmarks.,14.136035449054393, 75.02335901800281
Jog Falls,Shivamogga,Waterfall,August,Massive waterfall,https://i.pinimg.com/736x/63/87/2c/63872ce3ca1fbe8574de64a799df0b18.jpg,Jog Falls is one of the most spectacular waterfalls in India located in the Shivamogga district of Karnataka. It is formed by the Sharavathi River and is known for its breathtaking beauty and impressive height. The falls are especially stunning during the monsoon season when the water flow is at its peak creating a mesmerizing sight for visitors. Jog Falls is a popular destination for nature lovers and photographers looking to capture the grandeur of this natural wonder.,14.2292983,74.8123093
Kavaledurga Fort,Shivamogga,Forts,June,Fort with scenic views,https://www.matthuga.in/kodachadri/img/images/kaveldurga-1.jpg,Kavaledurga Fort is a historic fort located in the Shivamogga district of Karnataka. It is known for its strategic location and offers stunning views of the surrounding landscape. The fort has a rich history and features ancient architecture that attracts history enthusiasts and trekkers alike. Visitors can explore the fort's ruins and enjoy panoramic vistas making it a popular destination for those looking to experience the historical and natural beauty of Karnataka.,13.7189483,75.120869
Keladi,Shivamogga,Historical,April,Ancient Nayaka capital,https://karnatakatourism.org/_next/image/?url=https%3A%2F%2Fweb-cms.karnatakatourism.org%2Fwp-content%2Fuploads%2F2025%2F07%2FKeladi-Rameshawar-scaled.jpg&w=3840&q=75,Keladi is a historic town located in the Shivamogga district of Karnataka. It was the capital of the Keladi Nayakas a prominent dynasty that ruled the region in the 16th and 17th centuries. The town features several historical sites including the Rameshwara Temple and the Keladi Museum which showcase the rich cultural heritage and architectural brilliance of the Nayaka period. Keladi is a must-visit destination for history enthusiasts exploring Shivamogga.,14.2214761,75.0165753
Kodachadri,Shivamogga,Trekking,October,Famous trekking peak,https://encrypted-tbn0.gstatic.com/images?q=tbn:ANd9GcSO8v6x1lwCkI_bMJENm12yukQDqkqzeYwHtA&s,Kodachadri is a popular trekking destination located in the Shivamogga district of Karnataka. It is known for its scenic beauty and challenging trekking trails that lead to the summit. The peak offers breathtaking views of the surrounding hills and valleys making it a favorite spot for adventure enthusiasts and nature lovers visiting the region.,13.8671604,74.8957823
Kunchikal Falls,Shivamogga,Waterfall,June,Tallest waterfall in Karnataka,https://www.trawell.in/admin/images/upload/890876222Kunchikal.jpg,Kunchikal Falls is a tiered waterfall located in the Western Ghats near Nidagodu village in the Shivamogga district of Karnataka India. Formed by the Varahi River it is among the tallest waterfalls in India and a key hydrological feature in the region Approximately 455 meters (1493 feet).,13.6952414,75.0275534
Kundadri Hills,Shivamogga,Trekking,January,Sunrise viewpoint,https://encrypted-tbn0.gstatic.com/images?q=tbn:ANd9GcSn_Sy0U5UaBqFr8Twk0ZVuBa87eKYdsVTZ-Q&s,Kundadri Hills is a popular trekking destination located in the Shivamogga district of Karnataka. It is known for its stunning sunrise views and scenic landscapes. The trek to Kundadri Hills takes visitors through lush green hills and offers a refreshing experience for nature lovers and adventure enthusiasts. The viewpoint at the top provides a breathtaking panorama of the surrounding valleys and hills making it a must-visit spot for those exploring the region.,13.55588894484417, 75.17141828708723
Kuppalli Kavi Mane,Shivamogga,Cultural,February,Home of poet Kuvempu,https://explorersheaven.com/wp-content/uploads/2025/11/incredible_western_ghats_32771e867fb4403290a551cb5ed0eb9c-1.jpg,Kuppalli Kavi Mane is a cultural destination located in the Shivamogga district of Karnataka. It is the birthplace and home of the renowned Kannada poet Kuvempu. The house has been converted into a museum that showcases the life and works of Kuvempu providing visitors with insights into his literary contributions and the cultural heritage of Karnataka. Kuppalli Kavi Mane is a must-visit for literature enthusiasts and those interested in exploring the rich literary history of the region.,13.604974564034789, 75.31641669207242
Linganamakki Dam,Shivamogga,Dam,March,Reservoir area,https://encrypted-tbn0.gstatic.com/images?q=tbn:ANd9GcTA-N1zCxCMK9juJl0eRmTIympoHMaCeFjtGg&s,Linganamakki Dam is a picturesque reservoir located in the Shivamogga district of Karnataka. It is built across the Sharavathi River and offers a tranquil environment for visitors to relax and enjoy nature. The dam is surrounded by lush greenery and provides opportunities for boating and picnicking making it a popular destination for families and nature enthusiasts visiting the region.,14.1758978,74.8464624
Mandagadde Bird Sanctuary,Shivamogga,Wildlife,July,Bird watching destination,https://api.avathi.com/images/Ranganthittu1%20pic%202_1741086441.jpg,Mandagadde Bird Sanctuary is a serene sanctuary located in the Shivamogga district of Karnataka. It is situated on an island in the middle of the Tunga River and is home to a variety of bird species making it a popular destination for birdwatching enthusiasts. The sanctuary offers a peaceful environment for visitors to enjoy nature and observe birds in their natural habitat especially during the migratory season when the sanctuary comes alive with vibrant avian activity.,13.7404951,75.4604339
Sakrebailu Elephant Camp,Shivamogga,Wildlife,November,Elephant sanctuary,https://cdn.junglelodges.com/uploads/2025/08/WhatsApp-Image-2025-08-21-at-3.48.51-PM-scaled_935x518_acf_cropped.jpeg,Sakrebailu Elephant Camp is a unique wildlife sanctuary located in the Shivamogga district of Karnataka. It offers visitors the opportunity to interact with elephants learn about their behavior and even participate in activities such as feeding and bathing the elephants. The camp is set in a beautiful natural environment along the banks of the River Tunga making it a memorable experience for animal lovers and families visiting the region.,13.840766950156457, 75.51329120002146
Sharavathi Valley,Shivamogga,Nature,December,Valley forest region,https://thumbs.dreamstime.com/b/sharavati-river-valley-aerial-panoramic-view-india-sharavathi-viewpoint-near-jog-falls-waterfall-karnataka-state-352076237.jpg,Sharavathi Valley is a picturesque valley forest region located in the Shivamogga district of Karnataka. It is known for its lush greenery and tranquil environment making it a popular destination for nature lovers and those looking to experience the beauty of the region's natural landscapes. The valley offers opportunities for trekking and exploring the diverse flora and fauna of Karnataka's forests providing a refreshing escape for visitors seeking a connection with nature.,14.03931777566425, 74.92206810080873
Sigandur,Shivamogga,Pilgrimage,December,Famous temple,https://th-i.thgim.com/public/incoming/i6ztcu/article69033660.ece/alternates/FREE_1200/9911_27_12_2024_17_54_32_1_BRIDGE.JPEG,Sigandur is a renowned pilgrimage site located in the Shivamogga district of Karnataka. It is famous for the Sigandur Chowdeshwari Temple dedicated to Goddess Chowdeshwari. The temple is situated on an island in the backwaters of the Linganamakki Dam making it a unique and picturesque location for devotees and tourists alike with vibrant celebrations.,14.073425,74.904214
Tyavarekoppa,Shivamogga,Wildlife,June,Wildlife sanctuary,https://www.holidaymonk.com/wp-content/uploads/2015/05/Tyavarekoppa.jpg,Tyavarekoppa is a wildlife sanctuary located in the Shivamogga district of Karnataka. It is home to a variety of flora and fauna including deer peacocks and various species of birds. The sanctuary offers a peaceful environment for visitors to enjoy nature and spot wildlife in their natural habitat. Tyavarekoppa is a popular destination for nature lovers and those looking to experience the tranquility of the region's wilderness.,13.9749019,75.504593

Devarayanadurga,Tumakuru,Hill Station,August,Hill temple,https://imgstaticcontent.lbb.in/lbbnew/wp-content/uploads/sites/2/2017/02/07211606/Devarayanadurga-3.jpg,Devarayanadurga is a picturesque hill station located in the Tumakuru district of Karnataka. It is known for its serene environment lush greenery and ancient hill temples dedicated to Lord Devaraya and Goddess Yellamma. The hill station offers a perfect retreat for nature lovers and spiritual seekers alike making it a popular destination for those looking to experience the tranquility of Karnataka's hills.,13.3726702,77.2075933
Kunigal Kere,Tumakuru,Nature,May,Lake destination,https://encrypted-tbn0.gstatic.com/images?q=tbn:ANd9GcSfK9HM93uyaZPSTCWarCg3CpVzV-UyGgna6A&s,Kunigal Kere is a serene lake located in the Tumakuru district of Karnataka. It is known for its tranquil environment and beautiful surroundings making it a popular destination for nature lovers and those looking to experience the natural beauty of the region. The lake offers opportunities for boating and picnicking providing a perfect setting for relaxation and enjoying nature in Karnataka.,13.0408594,77.0413965
Kunigal Stud Farm,Tumakuru,Historical,June,Horse breeding farm,https://lh3.googleusercontent.com/gps-cs-s/APNQkAGUC_-d3zSE_VAhwg-mm-jKfx8yyw-QvHEQpGKMVihZ7mP5FY15mfsPDbtKpYunN7cXIMrbLtsIh9UwJhK36Ih8oRi7S6_Ike2DVD22vSPqkh8Rixcn4xhILk-KDBlTFvLWCepE4znWIdI=w1777-h1000-k-no,Kunigal Stud Farm is a historic horse breeding farm located in the Tumakuru district of Karnataka. It is known for its contribution to the equestrian industry and has been breeding horses for several decades. The farm offers visitors a chance to learn about horse breeding and care and is a popular destination for those interested in equestrian activities and the history of horse breeding in Karnataka.,13.0196575,77.0338287
Madhugiri Fort,Tumakuru,Forts,September,Fort trek,https://encrypted-tbn0.gstatic.com/images?q=tbn:ANd9GcRSuTQIpzxLfmF-H5V4_S0h3pZRvy3KMGqcuw&s,Madhugiri Fort is a historic fort located in the Tumakuru district of Karnataka. It is known for its impressive architecture and challenging trek to the summit. The fort offers stunning views of the surrounding landscape and is a popular destination for history enthusiasts and adventure seekers looking to explore the rich cultural heritage of Karnataka.,13.657851010379924, 77.2073113932136
Madhugiri Monolith,Tumakuru,Trekking,November,Asia's second largest monolith,https://encrypted-tbn0.gstatic.com/images?q=tbn:ANd9GcRsKduDJ_Xrm1lJloJxsSjl1MD1U7CrjXpBrw&s,Madhugiri Monolith is a popular trekking destination located in the Tumakuru district of Karnataka. It is known for being Asia's second largest monolith and offers a challenging trek to the summit. The trek provides stunning views of the surrounding landscape and is a favorite destination for adventure enthusiasts and nature lovers looking to explore the natural beauty of Karnataka's hills while engaging in an adventurous activity.,13.652346304592083, 77.20422148841253
Markonahalli Dam,Tumakuru,Dam,April,Reservoir destination,https://lh3.googleusercontent.com/gps-cs-s/APNQkAFqNRr8Tofuou7YM9JSSTKrsdtxYQHTxhXT-bnY1haaVIjGO_b2amfARmDFP2jvQdvFcYzwLERpRjrYKYnHFxZPgAMUIUd4mj2s8C5uUs0O8CPAi6zG_GUSp4KBJugpuphgQD2e=w1773-h1000-k-no,Markonahalli Dam is a scenic reservoir located in the Tumakuru district of Karnataka. It is built across the Shimsha River and offers a tranquil environment for visitors to relax and enjoy nature. The dam is surrounded by lush greenery and provides opportunities for boating and picnicking making it a popular destination for families and nature enthusiasts visiting the region.,12.934356005891669, 76.88209523387606
Pavagada Solar Park,Tumakuru,Industrial,January,Solar energy park,https://swarajya.gumlet.io/swarajya/2020-01/2f329b51-384f-46d3-b13a-d7be42f52155/Pavagada_Solar_Park.jpg?w=1200&h=675&auto=format%2Ccompress&fit=max&enlarge=true,Pavagada Solar Park is a significant industrial destination located in the Tumakuru district of Karnataka. It is known for being one of the largest solar energy parks in the world and contributes significantly to the renewable energy sector. The park offers insights into the advancements in solar technology and is a point of interest for those looking to explore the economic aspects of sustainable energy development in Karnataka.,14.2365432,77.4207264
Shivagange,Tumakuru,Trekking,July,Sacred hill,https://bangaloretourism.in/images/v2/headers/shivagange-bangalore-tourism-header.jpg,Shivagange is a sacred hill located in the Tumakuru district of Karnataka. It is known for its religious significance and is a popular destination for trekking and spiritual seekers. The hill features several temples and shrines dedicated to Lord Shiva making it a revered pilgrimage site. The trek to Shivagange offers stunning views of the surrounding landscape and provides a serene environment for visitors to experience the spiritual ambiance of this unique destination.,13.1687661768136, 77.22380986777289
Shree Siddagangaa Mutt,Tumakuru,Pilgrimage,March,Religious institution,https://encrypted-tbn0.gstatic.com/images?q=tbn:ANd9GcS4wzLvG80vdCXp-GAZRptDz1oY78nR3IbZ9w&s,Shree Siddagangaa Mutt is a renowned religious institution located in the Tumakuru district of Karnataka. It is known for its spiritual significance and attracts devotees from all over the region. The mutt offers a serene environment for worship and meditation making it a popular destination for those seeking spiritual solace in Karnataka. Shree Siddagangaa Mutt also features beautiful architecture and lush surroundings providing a peaceful retreat for visitors.,13.322950902808879, 77.15033617753105

Anegudde Vinayaka Temple,Udupi,Pilgrimage,June,Famous Ganapati temple,https://dynamic-media-cdn.tripadvisor.com/media/photo-o/1a/1a/01/f7/20191118-103815-largejpg.jpg?w=1200&h=-1&s=1,Anegudde Vinayaka Temple is a famous Ganapati temple located in the Udupi district of Karnataka. It is dedicated to Lord Ganesha and is known for its religious significance and vibrant festivals. The temple attracts devotees and tourists alike who come to seek blessings and experience the spiritual ambiance of this unique destination. Anegudde Vinayaka Temple offers a serene environment for worship and is a popular spot for those seeking spiritual solace in Karnataka.,13.569434527275229, 74.70492276855373
Anejhari Butterfly Camp,Udupi,Wildlife,May,Butterfly sanctuary,https://encrypted-tbn0.gstatic.com/images?q=tbn:ANd9GcT6QL459jwXbeFuf8QoL0vofGYWePO_apZYWg&s,Anejhari Butterfly Camp is a unique butterfly sanctuary located in the Udupi district of Karnataka. It is known for its efforts in conserving and protecting various species of butterflies providing a sanctuary for these delicate creatures. The camp offers visitors a chance to observe and learn about butterflies in their natural habitat making it a popular destination for wildlife enthusiasts and those interested in learning about butterfly conservation in Karnataka.,13.833020518021202, 74.80307958361148
Kamalashile Temple,Udupi,Pilgrimage,April,Ancient temple,https://d34vm3j4h7f97z.cloudfront.net/optimized/4X/b/4/6/b468cdd5ec269f9d36eb82b2a487758f812767bd_2_1035x582.jpeg,Kamalashile Shri Brahmi Durgaparameshwari Temple is an ancient temple located in the Udupi district of Karnataka. It is dedicated to Goddess Kamalashile and is known for its religious significance and architectural beauty. The temple attracts devotees and tourists alike who come to admire the intricate carvings and experience the spiritual ambiance of this unique destination. Kamalashile Temple offers a serene environment for worship and is a popular spot for those seeking spiritual solace in Karnataka.,13.71232345150247, 74.9111785384648
Karkala,Udupi,Historical,December,Jain heritage town,https://encrypted-tbn0.gstatic.com/images?q=tbn:ANd9GcTmFPMeykF-NRCsQ-HgEgfKl3pdiO6PnTaj2g&s,Karkala is a historic town located in the Udupi district of Karnataka. It is known for its rich Jain heritage and features several ancient Jain temples and monuments. The town is a significant destination for history enthusiasts and those interested in exploring Karnataka's diverse cultural heritage. Karkala offers visitors a glimpse into the region's past and is a popular spot for those looking to experience the historical landmarks of Udupi.,13.2145414,74.9951861
Kaup Beach,Udupi,Beach,March,Lighthouse beach,https://img-cdn.publive.online/fit-in/640x430/filters:format(webp)/30-stades/media/media_files/2025/07/05/kapu-beach-lighthouse-karnataka-lead-30stades-2025-07-05-21-22-30.jpg,Kaup Beach is a scenic beach located in the Udupi district of Karnataka. It is known for its picturesque lighthouse that stands tall against the backdrop of the Arabian Sea. The beach offers a tranquil environment for visitors to relax and enjoy the coastal beauty of Karnataka. Kaup Beach is a popular destination for nature lovers and photographers looking to capture stunning views of the sea and the iconic lighthouse.,13.224066999154294, 74.73667640639805
Kemmannu,Udupi,Beach,January,Backwater beach,https://encrypted-tbn0.gstatic.com/images?q=tbn:ANd9GcTTMvYWrKrbWaS7MTkToF92ndVitYOG4MGG9w&s,Kemmannu is a scenic backwater beach located in the Udupi district of Karnataka. It is known for its tranquil environment and beautiful surroundings making it a popular destination for beach lovers and those looking to experience the natural beauty of the region. The beach offers opportunities for leisurely walks and enjoying the serene atmosphere providing a perfect setting for relaxation and connecting with nature in Karnataka.,13.4007564,74.7091185
Kodi Beach,Udupi,Beach,July,Backwater beach,https://encrypted-tbn0.gstatic.com/images?q=tbn:ANd9GcRcmZXpDALquqgJ05Yn4mheGg8ybXqFy47qZg&s,Kodi Beach is a serene backwater beach located in the Udupi district of Karnataka. It is known for its tranquil environment and scenic beauty making it a perfect destination for those looking to escape the hustle and bustle of city life. The beach offers stunning views of the Arabian Sea and is a great spot for relaxation and enjoying the natural beauty of Karnataka's coastline.,13.6302717,74.6662563
Kolluru Mookambika Temple,Udupi,Pilgrimage,August,Famous temple,https://encrypted-tbn0.gstatic.com/images?q=tbn:ANd9GcR8JmrtIogzb1XhUUcqIK2qNbprcejvDTfWNA&s,Mookambika Temple is a famous temple located in the Udupi district of Karnataka. It is dedicated to Goddess Mookambika and is known for its religious significance and architectural beauty. The temple attracts devotees and tourists alike who come to admire the intricate carvings and experience the spiritual ambiance of this unique destination. Mookambika Temple offers a serene environment for worship and is a popular spot for those seeking spiritual solace in Karnataka.,13.86396715934003, 74.81536497805308
Kudlu Theertha Waterfalls,Udupi,Waterfall,September,Scenic waterfall,https://static2.tripoto.com/media/filter/tst/img/1398651/Image/1663012664_img_7128b.jpg.webp,Kudlu Theertha Waterfalls is a scenic waterfall located in the Udupi district of Karnataka. It is known for its tranquil environment and beautiful surroundings making it a popular destination for nature lovers and those looking to experience the natural beauty of the region. The waterfall offers opportunities for leisurely walks and enjoying the serene atmosphere providing a perfect setting for relaxation and connecting with nature in Karnataka.,13.413219596042573, 75.12213378175868
Malpe Beach,Udupi,Beach,January,Popular beach,https://encrypted-tbn0.gstatic.com/images?q=tbn:ANd9GcRvXtrIW_8jdNDqidB2vGzOb7x9WJvTLqIh2A&s,Malpe Beach is a popular beach located in the Udupi district of Karnataka. It is known for its clean sandy shores and vibrant atmosphere making it a favorite spot for locals and tourists alike. The beach offers various water sports activities and is a great place to relax and enjoy the coastal beauty of Karnataka.,13.362013,74.6978648
Manipal,Udupi,Education,April,Educational hub,https://encrypted-tbn0.gstatic.com/images?q=tbn:ANd9GcSIE5LqcBjL3VsGyKnNPpGtkmKvoHHWTTZ1Gg&s,Manipal is a vibrant city located in the Udupi district of Karnataka. It is known for being an educational hub with several prestigious institutions and universities. The city offers a lively atmosphere with a mix of modern amenities and cultural heritage making it a popular destination for students and tourists alike. Manipal also features beautiful landscapes and a thriving cultural scene making it a must-visit spot for those exploring the region.,13.3519723,74.7870308
Maravanthe Beach,Udupi,Beach,May,Highway beach,https://storage.googleapis.com/goa-app-12a91.appspot.com/2024-07-28T12%3A38%3A42.502Z8.1.webp?GoogleAccessId=firebase-adminsdk-zeqcj%40goa-app-12a91.iam.gserviceaccount.com&Expires=16447017600&Signature=LYg5Otr%2F7iEltXfShZ1X5yGbAFnBiDznHS6F8oIBiaNp3Wp2elYE2zeZfmEeUvhqqZGx%2FHTLdmD9k%2BvpBdNtAGDbjlG9Nuii9AqTUC%2BtKKtNZPws3CMGjsB9Gv8TDUCWMLRlboXngqrSfNgn06YXnZdJol4yuIz7Le%2FOvqpkcH7HwdgoIqO8OzRHLQuoT3lLJsIBjVlFLWQBTFQopFOiwnAvK89TwVZvHHdnj6e%2F803c9rzvCoMUKuVQu6pf0%2FZ71RsnBTCcSH3ii5R6iN2e%2BP5T7tV62a4G7caVhOhbK6p5xfD6qb1K8SAg3wdZ2STSrQ5vQK8kGF7bto6yryp5OQ%3D%3D,Maravanthe Beach is a unique beach located in the Udupi district of Karnataka. It is known for its picturesque setting where the Arabian Sea meets the Suparnika River creating a stunning coastal landscape. The beach is easily accessible as it is situated along a highway making it a popular stop for travelers exploring the region. Maravanthe Beach offers a tranquil environment for visitors to relax and enjoy the natural beauty of Karnataka's coastline.,13.7088543,74.6418646
Ottinene,Udupi,Beach,April,Cliffside viewpoint,https://kalavadyfarmstay.com/wp-content/uploads/2023/02/2022-09-10-915x610.jpg,Ottinene is a scenic cliffside viewpoint and beach in Byndoor located in the Udupi district of Karnataka. It is known for its breathtaking views of the surrounding landscape making it a popular destination for nature lovers and those looking to experience the natural beauty of the region. The viewpoint offers stunning panoramic views providing a perfect setting for relaxation and connecting with nature in Karnataka.,13.872987738128685, 74.60367802884736
Padubidri Beach,Udupi,Beach,February,Blue flag beach,https://karnatakatourism.org/_next/image/?url=https%3A%2F%2Fweb-cms.karnatakatourism.org%2Fwp-content%2Fuploads%2F2025%2F07%2FPadubidri-Beach.jpg&w=3840&q=75,Padubidri Beach is a beautiful blue flag beach located in the Udupi district of Karnataka. It is known for its clean and pristine environment making it a popular destination for beach lovers and those looking to experience the natural beauty of the region. The beach offers opportunities for leisurely walks and enjoying the serene atmosphere providing a perfect setting for relaxation and connecting with nature in Karnataka.,13.1161627,74.7658587
St Mary's Island,Udupi,Nature,February,Unique rock formations,https://carams.in/wp-content/uploads/2018/11/St-Mary.jpg,St Mary's Island is a unique natural destination located in the Udupi district of Karnataka. It is known for its distinctive rock formations that are believed to have been formed by volcanic activity millions of years ago. The island offers a serene environment for visitors to enjoy nature and capture stunning views of the Arabian Sea. St Mary's Island is a popular destination for nature lovers and photographers looking to experience the natural beauty of Karnataka's coastline.,13.3792064,74.6733444
Udupi Sri Krishna Matha,Udupi,Pilgrimage,September,Famous Krishna temple,https://magikindia.com/wp-content/uploads/2015/12/udupi-4.jpg,Udupi Sri Krishna Matha is a famous temple located in the Udupi district of Karnataka. It is dedicated to Lord Krishna and is known for its religious significance and vibrant festivals. The temple attracts devotees and tourists alike who come to seek blessings and experience the spiritual ambiance of this unique destination. Udupi Sri Krishna Matha offers a serene environment for worship and is a popular spot for those seeking spiritual solace in Karnataka.,13.341458500232372, 74.75232354974277
Varanga,Udupi,Historical,March,Jain heritage town,https://jainsattva.com/wp-content/uploads/2024/06/History-of-Varanga-Jain-Temple.jpg,Varanga is a historic town located in the Udupi district of Karnataka. It is known for its rich cultural heritage and historical significance as it features several ancient Jain temples and monuments. The town attracts history enthusiasts and those interested in exploring Karnataka's rich cultural heritage making it a must-visit destination for tourists exploring the region.,13.395931,75.003662

