Place,District,Category,Best_Month,Description,Image,Short_Description,Latitude,Longitude
Kalhatti Falls,Chikkamagaluru,Waterfall,June,Scenic waterfall,https://encrypted-tbn0.gstatic.com/images?q=tbn:ANd9GcSGl0farNrA1xYk1Tg6hHLi74kQavxmKISnRw&s,Kalhatti Falls is a scenic waterfall located in the Chikkamagaluru district of Karnataka. It is known for its natural beauty and tranquil surroundings making it a popular destination for nature lovers and photographers. The falls are especially impressive during the monsoon season when the water flow is at its peak creating a mesmerizing sight for visitors. Kalhatti Falls offers a serene environment for visitors to enjoy nature and capture the beauty of this natural wonder.,13.5492593,75.7888969
Kemmangundi Peak,Chikkamagaluru,Trekking,December,Mountain viewpoint,https://i.pinimg.com/564x/b0/c2/bd/b0c2bd26078c6d4fc89b70400ed05d46.jpg,Kemmangundi Peak is a popular mountain trekking destination located in the Chikkamagaluru district of Karnataka. It is known for its scenic beauty and challenging trekking routes making it a favorite destination for adventure enthusiasts and nature lovers. The trek to Kemmangundi Peak offers stunning views of the surrounding landscape and provides a refreshing experience for those looking to explore the natural beauty of Karnataka's hills while engaging in an adventurous activity.,13.5170519,75.771372
Kudremukh National Park,Chikkamagaluru,Wildlife,May,Mountain wildlife park,https://kudremukhnationalpark.org/wp-content/uploads/2025/10/kudremukh-trek-image-3-scaled.webp,Kudremukh National Park is a protected wildlife sanctuary located in the Chikkamagaluru district of Karnataka. It is known for its rich biodiversity and scenic landscapes featuring dense forests rolling hills and diverse flora and fauna. The park is home to various species of animals including tigers leopards and elephants making it a popular destination for wildlife enthusiasts and nature lovers visiting the region.,13.2539748,75.1830889
Kudremukh Peak,Chikkamagaluru,Trekking,May,Mountain trekking spot,https://dynamic-media-cdn.tripadvisor.com/media/photo-o/0c/8c/d0/a0/view.jpg?w=1200&h=1200&s=1,Kudremukh Peak is a popular mountain trekking spot located in the Chikkamagaluru district of Karnataka. It is known for its scenic beauty and challenging trekking routes making it a favorite destination for adventure enthusiasts and nature lovers. The trek to Kudremukh Peak offers stunning views of the surrounding landscape and provides a refreshing experience for those looking to explore the natural beauty of Karnataka's hills while engaging in an adventurous activity.,13.126844863480152, 75.271846290244
Mullayanagiri,Chikkamagaluru,Trekking,January,Highest peak in Karnataka,https://encrypted-tbn0.gstatic.com/images?q=tbn:ANd9GcQCfhOiCXlgeo061Bn2u22B3LyDqruVJK9-ug&s,Mullayanagiri is the highest peak in Karnataka located in the Chikkamagaluru district. It is a popular trekking destination known for its challenging trails and stunning panoramic views from the summit. The trek to Mullayanagiri takes visitors through lush green forests and offers a refreshing experience for nature lovers and adventure enthusiasts. The peak provides a breathtaking panorama of the surrounding hills and valleys making it a must-visit spot for those exploring the region.,13.3909217,75.7214034
Samse Tea Estate,Chikkamagaluru,Nature,April,Tea plantation,https://mycameralog.com/wp-content/uploads/2023/07/IMG_8112.jpg,Samse Tea Estate is a picturesque tea plantation located in the Chikkamagaluru district of Karnataka. It is known for its lush green tea gardens and serene environment making it a popular destination for nature lovers and those looking to experience the beauty of tea plantations. Visitors can take leisurely walks through the tea gardens and enjoy the tranquil surroundings while learning about the tea production process in Karnataka.,13.195703492212745, 75.33740803077565
Sringeri,Chikkamagaluru,Pilgrimage,October,Famous Sharada Peetham,https://chaloghumane.com/wp-content/uploads/2023/08/Sringeri-Temple.jpg,Sringeri is a renowned pilgrimage site located in the Chikkamagaluru district of Karnataka. It is famous for the Sharada Peetham a prominent Hindu monastery dedicated to Goddess Sharada. The monastery is known for its spiritual significance and attracts devotees from across the country. Sringeri offers a serene environment for worship and is a popular destination for those seeking spiritual solace in Karnataka.,13.4261724,75.255369
Z Point,Chikkamagaluru,Trekking,August,Sunrise trekking spot,https://muddietrails.com/wp-content/uploads/2025/08/Untitled-design-7-1.png,Z Point is a popular sunrise trekking spot located in the Chikkamagaluru district of Karnataka. It is known for its breathtaking views of the sunrise over the hills and valleys making it a favorite destination for nature lovers and adventure enthusiasts. The trek to Z Point offers stunning panoramic views of the surrounding landscape and provides a refreshing experience for those looking to explore the natural beauty of Karnataka's hills while witnessing the beauty of a sunrise.,13.5556702,75.7631135

Chandravalli Caves,Chitradurga,Historical,June,Ancient cave site,https://encrypted-tbn0.gstatic.com/images?q=tbn:ANd9GcTYov6T87xDid5P8mUviDlf2o-V1nGGP08Q3Q&s,Chandravalli Caves is an ancient cave site located in the Chitradurga district of Karnataka. It is known for its historical significance as it has yielded valuable archaeological findings including ancient artifacts and inscriptions. The caves offer a glimpse into the region's past and are a popular destination for history enthusiasts and those interested in exploring Karnataka's rich cultural heritage.,14.205553316168004, 76.38154746085581
Chitradurga Fort,Chitradurga,Forts,April,Massive hill fort,https://encrypted-tbn0.gstatic.com/images?q=tbn:ANd9GcTbFfAY7_arGn6OlYJIdJbT_j6IqhQ41w2naw&s,Chitradurga Fort is a massive hill fort located in the Chitradurga district of Karnataka. It is known for its impressive architecture and historical significance as it has witnessed several battles and rulers over the centuries. The fort offers stunning views of the surrounding landscape and is a popular destination for history enthusiasts looking to explore the rich cultural heritage of Karnataka.,14.2130469,76.3948857
Hidimbeshwara Temple,Chitradurga,Historical,May,Ancient temple,https://images.openai.com/static-rsc-4/uEqrgl5smgDNMQ_X-j29qFc9KKU9ixs6dG_RjDxo-kaDDkJ0Q-1d4PGEoO8efYUKe-x8AdJCKbr1R8cLSc76Y9djlsbM7YC3ter4tIKAQoqMsTVxyAiScuLKhfrUHmT9CqU3Ke8oS6qoaX7Wmr5NPMyZiBWkKlCTYRycBmdASIthggp6YtRs0fuoXM_8ogPR?purpose=fullsize,Hidimbeshwara Temple is an ancient temple located in the Chitradurga district of Karnataka. It is dedicated to Lord Hidimba a character from the Indian epic Mahabharata and is known for its historical significance and architectural beauty. The temple attracts devotees and tourists alike who come to admire the intricate carvings and experience the spiritual ambiance of this unique destination. Hidimbeshwara Temple offers a serene environment for worship and is a popular spot for those seeking spiritual solace in Karnataka.,14.215853006225382, 76.3963433301669
Jogimatti,Chitradurga,Nature,July,Hill forest area,https://mycameralog.com/wp-content/uploads/2024/09/Jogi_06-1024x682.jpg,Jogimatti is a hill forest area located in the Chitradurga district of Karnataka. It is known for its lush greenery serene environment and diverse flora and fauna making it a popular destination for nature lovers and those looking to experience the tranquility of the region. Jogimatti offers opportunities for trekking and exploring the beautiful landscapes of Karnataka's countryside.,14.1769813,76.3889744
Molakalmuru,Chitradurga,Textile,September,Famous Saree,https://caleidoscope.in/wp-content/uploads/2021/07/Molakalmuru-Saree-Info.jpg,Molakalmuru is a town located in the Chitradurga district of Karnataka known for its famous Molakalmuru Saree. The saree is renowned for its intricate designs and vibrant colors making it a popular choice among saree enthusiasts. Molakalmuru Sarees are handwoven using traditional techniques and are considered a symbol of Karnataka's rich textile heritage. The town attracts visitors interested in exploring the cultural and artistic aspects of Karnataka's textile industry.,14.7173158,76.7454574
Onake Obavva Kindi,Chitradurga,Historical,May,Historic well,https://images.openai.com/static-rsc-4/QIhPYaS3982sIue4rw4d9WjKJczvKsGXeuIFp3v3bv4gK_ukWdA8T56L1G9CMPmyYiiCXb_RYoiUecZU0CaOtbY2YLlMX3JVVWP-2NumK92SyuLlNRPLJoIvW5eEYDlSPK-ABwED17iX2FSDNQZFAt5sxmksufvi7VIPI6fdQOsKdz33cTiP7K6qXIcYCJiA?purpose=fullsize,Onake Obavva Kindi is a historic well located in the Chitradurga district of Karnataka. It is known for its historical significance as it is associated with the legendary figure Onake Obavva who is said to have defended the fort against invading forces using a pestle. The well serves as a reminder of the bravery and resilience of the people of Chitradurga and is a popular destination for history enthusiasts exploring the region.,14.216361412836093, 76.39229835398918
Vani Vilas Sagar,Chitradurga,Dam,May,Historic dam reservoir,https://dynamic-media-cdn.tripadvisor.com/media/photo-o/09/e1/6c/e4/vani-vilas-sagar-dam.jpg?w=1200&h=-1&s=1,Vani Vilas Sagar also known as Mari Kanive is a historic dam reservoir located in the Chitradurga district of Karnataka. It is built across the Vedavathi River and offers a tranquil environment for visitors to relax and enjoy nature. The reservoir is surrounded by lush greenery and provides opportunities for boating and picnicking making it a popular destination for families and nature enthusiasts visiting the region.,13.888421988474022, 76.49014239154472

Dharmasthala,Dakshina Kannada,Pilgrimage,December,Famous temple town,https://myholidayhappiness.com/uploads/dharmasthala-temple-6402.jpg,Dharmasthala is a famous temple town located in the Dakshina Kannada district of Karnataka. It is known for the Dharmasthala Manjunatha Temple which is a significant pilgrimage site for devotees. The temple is dedicated to Lord Manjunatha and attracts visitors from across the country who come to seek blessings and experience the spiritual ambiance of this unique destination. Dharmasthala also features beautiful landscapes and cultural heritage making it a must-visit spot for tourists exploring the region.,12.9519571,75.3813122
Kadri Manjunath Temple,Dakshina Kannada,Pilgrimage,November,Ancient temple,https://encrypted-tbn0.gstatic.com/images?q=tbn:ANd9GcQOM165INzgmYqjf3xFOS3GqYRW1VPHZzKEYg&s,Kadri Manjunath Temple is an ancient temple located in the Dakshina Kannada district of Karnataka. It is dedicated to Lord Manjunatha and is known for its religious significance and architectural beauty. The temple attracts devotees and tourists alike who come to admire the intricate carvings and experience the spiritual ambiance of this unique destination. Kadri Manjunath Temple offers a serene environment for worship and is a popular spot for those seeking spiritual solace in Karnataka.,12.886179064901514, 74.85685348887111
Kateel Temple,Dakshina Kannada,Pilgrimage,December,Famous Durga temple,https://s7ap1.scene7.com/is/image/incredibleindia/kateel-durga-parameshwari-temple-mangalore-karnataka-attr-about?qlt=82&ts=1726722305577,Kateel Temple is a famous Durga temple located in the Dakshina Kannada district of Karnataka. It is known for its religious significance and attracts devotees from across the region who come to seek blessings and experience the spiritual ambiance of this unique destination. The temple features beautiful architecture and serene surroundings making it a popular spot for those seeking spiritual solace in Karnataka while also providing insights into the region's cultural heritage.,13.043752,74.8697311
Kukke Subramanya,Dakshina Kannada,Pilgrimage,January,Famous pilgrimage site,https://encrypted-tbn0.gstatic.com/images?q=tbn:ANd9GcTmzbMZL-cxWKVEdzVYXojoSgRLGfmtDnVN6g&s,Kukke Subramanya is a famous pilgrimage site located in the Dakshina Kannada district of Karnataka. It is known for the Kukke Subramanya Temple which is dedicated to Lord Subramanya and is a significant destination for devotees. The temple is surrounded by lush greenery and offers a serene environment for worship making it a popular spot for those seeking spiritual solace in Karnataka. Kukke Subramanya also features beautiful landscapes and cultural heritage making it a must-visit destination for tourists exploring the region.,12.6687622,75.6538748
Mangalore Port,Dakshina Kannada,Port,August,Historic port,https://upload.wikimedia.org/wikipedia/commons/a/a3/New_Mangalore_Port.jpg,Mangalore Port is a historic port located in the Dakshina Kannada district of Karnataka. It is known for its strategic location and historical significance as it has been a major trading hub for centuries. The port offers insights into the maritime history of the region and is a popular destination for those interested in exploring the economic and cultural aspects of Karnataka's coastal heritage.,12.9469448,74.8123039
Moodabidri,Dakshina Kannada,Historical,September,Jain heritage town,https://encrypted-tbn0.gstatic.com/images?q=tbn:ANd9GcRZ7c9fPII1Ld5K6s2BEd2SiddNKv5BvF6cwQ&s,Moodabidri is a historic town located in the Dakshina Kannada district of Karnataka. It is known for its rich cultural heritage and historical significance as it features several ancient Jain temples and monuments. The town attracts history enthusiasts and those interested in exploring Karnataka's rich cultural heritage making it a must-visit destination for tourists exploring the region.,13.0699218,74.9977469
Panambur Beach,Dakshina Kannada,Beach,September,Popular beach destination,https://s3.india.com/wp-content/uploads/2024/02/Panambur-Beach.jpg,Panambur Beach is a popular beach destination located in the Dakshina Kannada district of Karnataka. It is known for its clean sandy shores and vibrant atmosphere making it a favorite spot for locals and tourists alike. The beach offers various water sports activities and is a great place to relax and enjoy the coastal beauty of Karnataka.,12.9373062,74.8042355
Someshwara Beach,Dakshina Kannada,Beach,October,Scenic beach,https://images.openai.com/static-rsc-4/Gjs2xMBoYUUPd_2wX2-mL2UXpJRYc0zkklhkfH5KUbzJjStkbTnSsgVh--RIqy23hRXrkF_mBnTo4TaE12CYSvmiRNoNwj-ZxlVaQadsPboVCuxwl2gKxjnMfGoSw1wKV2up7-tldZjjyB9uZ6N6f_v7WCQTtlIkBKb1xddYiatYa-PYKgmhCRO77FKBo46L?purpose=fullsize,Someshwara Beach is a scenic coastal destination located in Ullal a suburb of Mangaluru in Dakshina Kannada district Karnataka India Known for its natural rock formations and tranquil setting the beach is a favorite among locals and travelers seeking a quieter alternative to Mangaluru’s urban shores.Adjacent to the beach is the centuries-old Someshwara Temple believed to have been built during the reign of the Kadamba dynasty. The temple and beach together hold religious importance for devotees of Lord Shiva,12.7953712,74.8480244
Tannirbhavi Beach,Dakshina Kannada,Beach,October,Peaceful beach,https://karnatakatourism.org/_next/image/?url=https%3A%2F%2Fweb-cms.karnatakatourism.org%2Fwp-content%2Fuploads%2F2025%2F06%2FTannirbhavi-Beach-e1750678541671.jpg&w=3840&q=75,Tannirbhavi Beach is a peaceful beach located in the Dakshina Kannada district of Karnataka. It is known for its serene environment and clean shores making it a perfect destination for those looking to escape the hustle and bustle of city life. The beach offers stunning views of the Arabian Sea and is a great spot for relaxation and enjoying the natural beauty of Karnataka's coastline.,12.9080902,74.8101698
Ullal Beach,Dakshina Kannada,Beach,November,Calm beach,https://encrypted-tbn0.gstatic.com/images?q=tbn:ANd9GcQ7HoqHdFAwR2K2fRD9jIUEARUhXmxDizIJig&s,Ullal Beach is a calm and serene beach located in the Dakshina Kannada district of Karnataka. It is known for its tranquil environment and beautiful surroundings making it a popular destination for beach lovers and those looking to experience the natural beauty of the region. The beach offers opportunities for leisurely walks and enjoying the serene atmosphere providing a perfect setting for relaxation and connecting with nature in Karnataka.,12.8114458,74.8407282

Bagali,Davanagere,Historical,November,Ancient temple village,https://images.openai.com/static-rsc-4/Imw2KU5nk_bh0Sx03_ldDQDuZqMheVCJAb7JmMC6Qrzo35uTyUGAm72LGEHxIQ4Nc_jXVZctbvbQYZmvGgLpsRwD0grhtIuX5bJPzedEZW3haPrgeJzjvpNBGgPRTb1AgDf8_weIoAZJogJRx_oW_plATK1vL8fKXvRXyxIor9P08Dc-XaB2xHse89jXme14?purpose=fullsize,Bagali is an ancient temple village located in the Davanagere district of Karnataka. It is known for its rich history and cultural heritage as it features several ancient temples and historical landmarks. The village attracts history enthusiasts and those interested in exploring Karnataka's rich cultural heritage making it a must-visit destination for tourists exploring the region.,14.8441375,75.9764174
Bathi Gudda,Davanagere,Trekking,December,Hill trekking spot,https://avathioutdoors.gumlet.io/travelGuide/dev/davangere_P9017.jpg?w=600&h=400&format=webp&q=80&compress=true,Bathi Gudda is a popular hill trekking spot located in the Davanagere district of Karnataka. It is known for its scenic beauty and serene environment making it a favorite destination for nature lovers and adventure enthusiasts. The trek to Bathi Gudda offers stunning views of the surrounding landscape and provides a refreshing experience for those looking to explore the natural beauty of Karnataka's hills.,14.48453696476391, 75.84994197434749
Davanagere,Davanagere,City,January,Commercial hub,https://images.squarespace-cdn.com/content/v1/603bc7becf34a07d765fc033/0373b87a-0f4f-4394-b29d-e6d5eac776ad/photo-output.jpg,Davanagere is a bustling city located in the central part of Karnataka. It is known for its commercial significance and for its famous Benne Dosa and serves as a major hub for trade and industry in the region. The city offers a mix of modern amenities and cultural heritage making it a popular destination for business travelers and tourists alike. Davanagere is also known for its vibrant markets and diverse culinary scene providing visitors with a taste of Karnataka's rich culture.,14.4661266,75.9206361
Harihar,Davanagere,Historical,September,Famous temple town,https://encrypted-tbn0.gstatic.com/images?q=tbn:ANd9GcT-9gUPuvsEaBKfnFpQu7at8zefwOtRvwwPeQ&s,Harihar is a famous temple town located in the Davanagere district of Karnataka. It is known for its rich history and cultural heritage as it features several ancient temples and historical landmarks. The town attracts history enthusiasts and those interested in exploring Karnataka's rich cultural heritage making it a must-visit destination for tourists exploring the region.,14.5116874,75.809288
Kondajji lake,Davanagere,Nature,June,Scenic lake,https://blogger.googleusercontent.com/img/b/R29vZ2xl/AVvXsEifc0RW55te0rk0bSpeVfB4ryo6RxZT7Z0a763cQz2Kb1J6X8EgAx5ftDQJmmUpys7eR3AZpGMDr6eBnma7v77C6cjHgaBwEsKN04ehQS7q4QcMNwBh8rWU3yEZAJPb3sN_lKb_xnVf7vOByEPcfuCJvbD537sJs1Pd8JX94jWEtV6DpJq4pUj9xa8ZJIEg/s1200/Kondajji-Lake.jpeg,Kondajji Lake is a scenic lake located in the Davanagere district of Karnataka. It is known for its tranquil environment and beautiful surroundings making it a popular destination for nature lovers and those looking to experience the natural beauty of the region. The lake offers opportunities for boating and picnicking providing a perfect setting for relaxation and enjoying nature in Karnataka.,14.569949276320356, 75.88930179873357
Kunduvada Lake,Davanagere,Nature,October,Scenic lake,https://encrypted-tbn0.gstatic.com/images?q=tbn:ANd9GcQicAlv6AApEpmJE3d9JLlgXHwC9Tg5WySFaA&s,Kunduvada Lake is a scenic lake located in the Davanagere district of Karnataka. It is known for its tranquil environment and beautiful surroundings making it a popular destination for nature lovers and those looking to experience the natural beauty of the region. The lake offers opportunities for boating and picnicking providing a perfect setting for relaxation and enjoying nature in Karnataka.,14.455890648316734, 75.8927258820454
Sulekere,Davanagere,Nature,January,Large lake reservoir,https://hblimg.mmtcdn.com/content/hubble/img/davangreeImage/mmt/activities/m_sulekere_davangere_1_l_427_640.jpg,Sulekere is a large lake reservoir located in the Davanagere district of Karnataka. It is known for its tranquil environment and scenic beauty making it a popular destination for nature lovers and those looking to experience the natural beauty of the region. The reservoir offers opportunities for boating and picnicking providing a perfect setting for relaxation and enjoying nature in Karnataka.,14.1280893,75.9161767
Uchangidurga,Davanagere,Forts,November,Ancient fort,https://encrypted-tbn0.gstatic.com/images?q=tbn:ANd9GcQYoRAB8RGK1JhkG3b_-PUVQKB5rL8U7WAb8Q&s,Uchangidurga is an ancient fort located in the Davanagere district of Karnataka. It is known for its historical significance and architectural beauty as it features intricate carvings and structures that showcase the artistic brilliance of the period. The fort attracts history enthusiasts and those interested in exploring Karnataka's rich cultural heritage making it a must-visit destination for tourists exploring the region.,14.56377272333064, 76.05438594958078

Dharwad,Dharwad,Education,May,University city,https://www.iitdh.ac.in/themes/base/images/thumb-abt-iitdh.jpg,Dharwad is a vibrant city located in the Dharwad district of Karnataka. It is known for its educational institutions and cultural heritage making it a popular destination for students and academics alike. The city offers a mix of modern amenities and traditional charm providing visitors with a unique experience of Karnataka's rich culture and academic excellence.,15.4540505,75.0066516
Hubballi,Dharwad,City,February,Commercial hub,https://equestrianstatue.org/wp-content/uploads/2016/04/India-Hubli-Kitturu-Chennamma-2-525x394.jpg,Hubballi is a bustling city located in the Dharwad district of Karnataka. It is known for its commercial significance and serves as a major hub for trade and industry in the region. The city offers a mix of modern amenities and cultural heritage making it a popular destination for business travelers and tourists alike. Hubballi is also known for its vibrant markets and diverse culinary scene providing visitors with a taste of Karnataka's rich culture.,15.3518378,75.1379848
Indira Gandhi Glass House Garden,Dharwad,Nature,April,Glass house garden,https://roamaround.app/api/getDestinationPicture?placeName=Indira%20Gandhi%20Glass%20House%20Garden%20Hubli,Indira Gandhi Glass House Garden is a beautiful garden located in the Hubli of Karnataka. It is known for its unique glass house structure that houses a variety of plants and flowers creating a picturesque setting for visitors. The garden offers a tranquil environment for nature lovers and those looking to experience the beauty of Karnataka's flora while enjoying a peaceful stroll through the lush greenery.,15.351342043191016, 75.13404861430041
Karnataka University,Dharwad,Education,May,University campus,https://images.openai.com/static-rsc-4/sQhHN1yMJpvYWBrRCZFykxqH4Mb7bGf-HG2FFHFIzxjcquXbd9WIx1PFSpSV-ANYnqhJ_P7pibZN4JYN37UkrKq8m2Z5xvVszSdP4Auma0Y2hOKzhODL5Hq4i4oIF4gndECVlD08cGjUFGibqiH1AgkPtXeJv1SmOdI2cBMF-6DJiYga6hSSmWskGb8y0ZR4?purpose=fullsize,Karnataka University is a prestigious educational institution located in the Hubli of Karnataka. It is known for its academic excellence and vibrant campus life making it a popular destination for students and academics alike. The university offers a wide range of courses and research opportunities providing a stimulating environment for learning and intellectual growth in Karnataka.,15.3992372,75.0729891
Nrupatunga Betta,Dharwad,Trekking,July,Hill viewpoint,https://thumbs.dreamstime.com/b/lake-seen-nrupatunga-betta-hubli-karnataka-photograph-captured-evening-picturesque-along-infinite-78903601.jpg,Nrupatunga Betta is a popular trekking destination located in the Hubli of Karnataka. It is known for its scenic hill viewpoint that offers stunning panoramic views of the surrounding landscape. The trek to Nrupatunga Betta takes visitors through lush greenery and provides a refreshing experience for nature lovers and adventure enthusiasts. The hill offers a tranquil environment for visitors to enjoy nature and capture breathtaking views of the region.,15.376087876773962, 75.130176518528
PRS Water Park Hubli,Dharwad,Adventure,June,Water park,https://jyoticentralschool.in/wp-content/uploads/2025/02/Untitled-design-94-1.png,PRS Water Park is a popular recreational destination located in the Hubli of Karnataka. It is known for its exciting water rides and attractions making it a favorite spot for families and thrill-seekers. The water park offers a fun-filled environment for visitors to enjoy and beat the heat while experiencing the vibrant atmosphere of this unique destination in Karnataka.,15.101147775177619, 75.15284500688918
Sadhankeri Park,Dharwad,Garden,May,Urban park,https://blog-img-dev.s3.ap-south-1.amazonaws.com/blog/wp-content/uploads/2024/09/Sadhankeri-Park.jpg,Sadhankeri Park is an urban park located in the Hubli of Karnataka. It is known for its lush greenery serene environment and recreational facilities making it a popular destination for families and nature lovers. The park offers a perfect setting for relaxation and enjoying nature in the heart of the city providing a refreshing escape from the hustle and bustle of urban life in Karnataka.,15.4650989,74.9873211
