Place,District,Category,Best_Month,Description,Image,Short_Description,Latitude,Longitude
Dubare Elephant Camp,Kodagu,Wildlife,September,Elephant interaction camp,https://myholidayhappiness.com/uploads/dubare-elephant-camp-coorg-6792.jpg,Dubare Elephant Camp is a unique wildlife attraction located in the Kodagu district of Karnataka. It offers visitors the opportunity to interact with elephants learn about their behavior and even participate in activities such as feeding and bathing the elephants. The camp is set in a beautiful natural environment along the banks of the River Cauvery making it a memorable experience for animal lovers and families visiting Coorg.,12.3710485,75.9051815
Dubare Forest,Kodagu,Wildlife,September,Forest camp,https://media1.thrillophilia.com/filestore/lk4or5esqbw35v310ilq1len0zpv_1539262336_shutterstock_1026266113.jpg,Dubare Forest is a beautiful forest area located in the Kodagu district of Karnataka. It is part of the Dubare Elephant Camp and offers visitors the opportunity to explore the natural surroundings and spot wildlife such as deer birds and monkeys. The forest is a popular destination for nature lovers and those looking to experience the tranquility of Coorg's wilderness.,12.360312604220017, 75.95564425907611
Harangi Dam,Kodagu,Dam,March,Reservoir attraction,https://www.trawell.in/admin/images/upload/176089739HarangiDam_Main.jpg,Harangi Dam is a picturesque reservoir located in the Kodagu district of Karnataka. It is surrounded by lush greenery and offers a tranquil environment for visitors to relax and enjoy nature. The dam is a popular spot for picnics and boating providing a serene escape for families and nature enthusiasts visiting Coorg.,12.4928663,75.9056999
Honnamana Kere,Kodagu,Nature,January,Beautiful lake,https://encrypted-tbn0.gstatic.com/images?q=tbn:ANd9GcTWLhWjQpoud75OOCNhxVNYTasr6ChPjQCzxQ&s,Honnamana Kere is a beautiful lake located in the Kodagu district of Karnataka. It is known for its tranquil environment and scenic beauty making it a popular destination for nature lovers and those looking to experience the natural beauty of the region. The lake offers opportunities for boating and picnicking providing a perfect setting for relaxation and enjoying nature in Karnataka.,12.62120064176561, 75.88039582976886
Iruppu Falls,Kodagu,Waterfall,January,Forest waterfall,https://upload.wikimedia.org/wikipedia/commons/thumb/8/8c/Iruppu_Falls_%2849099719332%29.jpg/250px-Iruppu_Falls_%2849099719332%29.jpg,Iruppu Falls is a beautiful waterfall located in the Kodagu district of Karnataka. It is nestled within a dense forest and is a popular destination for nature lovers and trekkers. The falls are especially impressive during the monsoon season when the water flow is at its peak. Iruppu Falls is also associated with Hindu mythology and is considered a sacred site attracting both devotees and tourists alike.,11.9667954,75.9839484
Kote Betta,Kodagu,Trekking,February,Mountain trekking spot,https://encrypted-tbn0.gstatic.com/images?q=tbn:ANd9GcQBjwsXUi6Am8zkT949xXk0JEjL3szeJR8jVg&s,Kote Betta is a popular mountain trekking spot located in the Kodagu district of Karnataka. It is known for its scenic beauty and challenging trekking routes making it a favorite destination for adventure enthusiasts and nature lovers. The trek to Kote Betta offers stunning views of the surrounding landscape and provides a refreshing experience for those looking to explore the natural beauty of Karnataka's hills while engaging in an adventurous activity.,12.5365245,75.7575502
Madikeri Fort,Kodagu,Forts,June,Historic fort,https://paradisecoorg.com/images/madikeri-fort.jpg,Madikeri Fort is a historic fort located in the Kodagu district of Karnataka. It was built in the 17th century and has witnessed various historical events over the centuries. The fort features a blend of Portuguese and Indian architectural styles and offers panoramic views of the surrounding hills and valleys. Visitors can explore the fort's ramparts watchtowers and museum to learn about its rich history and significance in the region.,12.4210485,75.7385818
Mallalli Falls,Kodagu,Waterfall,August,Scenic waterfall,https://upload.wikimedia.org/wikipedia/commons/1/1e/Mallalli_falls_1.jpg,Mallalli Falls is a breathtaking waterfall located in the Kodagu district of Karnataka. It is surrounded by lush greenery and offers a serene environment for visitors to enjoy nature. The falls are especially impressive during the monsoon season when the water flow is at its peak. Mallalli Falls is a popular destination for nature lovers and photographers looking to capture the beauty of this natural wonder.,12.6812226,75.7236637
Mandalpatti,Kodagu,Trekking,February,Sunrise viewpoint,https://coorgtourism.co.in/images/tourist-places/mandalpatti-trek/mandalpatti-trek-coorg-tourism-entry-ticket-price.jpg,Mandalpatti is a popular trekking destination located in the Kodagu district of Karnataka. It is known for its stunning sunrise views and scenic landscapes. The trek to Mandalpatti takes visitors through lush green hills and coffee plantations offering a refreshing experience for nature lovers and adventure enthusiasts. The viewpoint at the top provides a breathtaking panorama of the surrounding valleys and hill making it a must-visit spot for those exploring Coorg.,12.5460548,75.7019173
Nagarhole National Park,Kodagu,Wildlife,May,Famous tiger reserve,https://www.tigersafariindia.com/blog/wp-content/uploads/2023/11/bengal-tiger-walking-in-Nagarhole-National-Park.jpg,Nagarhole National Park is a renowned wildlife sanctuary located in the Kodagu district of Karnataka. It is part of the Nilgiri Biosphere Reserve and is known for its rich biodiversity including tigers elephants leopards and various species of birds. The park offers safari tours allowing visitors to experience the beauty of nature and observe wildlife in their natural habitat. Nagarhole National Park is a must-visit destination for nature lovers and wildlife enthusiasts.,12.0599313,76.1541467
Namdroling Monastery,Kodagu,Pilgrimage,November,Tibetan monastery,https://www.hoteldekho.com/storage/img/tourattraction/1651210603namdroling-monastery-1610348120.jpeg,Namdroling Monastery is a significant pilgrimage site located in the Kodagu district of Karnataka. It is known for its Tibetan Buddhist monastery and attracts devotees and tourists alike who come to seek blessings and experience the spiritual ambiance of this unique destination. The monastery features beautiful architecture and serene surroundings making it a popular spot for those seeking spiritual solace in Karnataka while also offering insights into Tibetan culture and Buddhism.,12.430764205167694, 75.96750077064715
Nisargadhama,Kodagu,Nature,November,Bamboo forest island,https://gos3.ibcdn.com/ed8bd108871f11eb86e10242ac110002.jpg,Nisargadhama is a serene nature park located in the Kodagu district of Karnataka. It is an island formed by the River Cauvery and is covered with lush bamboo groves sandalwood trees and other flora. The park offers a peaceful environment for visitors to enjoy nature take leisurely walks and spot wildlife such as deer and birds. Nisargadhama is a popular destination for families and nature enthusiasts looking to escape the hustle and bustle of city life.,12.4416321,75.9335252
Omkareshwara Temple,Kodagu,Pilgrimage,July,Famous temple,https://encrypted-tbn0.gstatic.com/images?q=tbn:ANd9GcRpXWjphgjKFBVlXY8lQPaDjHEcCQwuUFYbHQ&s,Omkareshwara Temple is a renowned pilgrimage site located in the Kodagu district of Karnataka. It is dedicated to Lord Shiva and is known for its unique blend of Islamic and Gothic architectural styles. The temple features intricate carvings and beautiful stained glass windows making it a significant attraction for devotees and tourists visiting Coorg.,12.4205417,75.7412594
Kumara Parvatha Pushpagiri,Kodagu,Trekking,October,Mountain trekking area,https://res.cloudinary.com/doivecad8/image/upload/v1677655182/banbanjara/brjtm8a7ydlparun9vfs.webp,Pushpagiri is a popular mountain trekking area located in the Kodagu district of Karnataka. It is known for its scenic beauty and challenging trekking routes making it a favorite destination for adventure enthusiasts and nature lovers. The trek to Pushpagiri offers stunning views of the surrounding landscape and provides a refreshing experience for those looking to explore the natural beauty of Karnataka's hills while engaging in an adventurous activity.,12.663682700324612, 75.68923475192356
Raja Seat,Kodagu,Nature,December,Famous viewpoint,https://explorekodagu.com/assets/img/blogs/46_rajas-seat-3.jpg,Raja Seat is a famous viewpoint located in the Kodagu district of Karnataka. It offers breathtaking panoramic views of the surrounding hills and valleys especially during sunrise and sunset. The viewpoint is adorned with colorful flowers and is a popular spot for couples and tourists looking to enjoy the natural beauty of Coorg. Raja Seat is also known for its pleasant climate and serene ambiance making it a must-visit destination in Kodagu.,12.4142198,75.7369653
Talacauvery,Kodagu,Pilgrimage,October,Origin of River Cauvery,https://encrypted-tbn0.gstatic.com/images?q=tbn:ANd9GcRnnlF4PYSBr8mfs4NykbjU3rsN_OC3vOLE1g&s,Talacauvery is a sacred pilgrimage site located in the Kodagu district of Karnataka. It is believed to be the origin of the River Cauvery one of the major rivers in South India. The site features a temple dedicated to Goddess Cauvery and is surrounded by scenic hills and lush greenery. Talacauvery attracts devotees and nature lovers alike who come to witness the spiritual significance and natural beauty of this revered location.,12.3862569,75.5280028

Anthargange,Kolar,Trekking,May,Cave trekking site,https://nammatrip.in/uploads/events/89/gallery_img_682462542047d.png,Anthargange is a popular trekking destination located in the Kolar district of Karnataka. It is known for its unique cave trekking experience where visitors can explore a network of caves and tunnels while trekking through the scenic hills. The area offers a serene environment for nature lovers and adventure enthusiasts making it a must-visit spot for those looking to experience the thrill of cave trekking in Karnataka.,13.143135201061462, 78.10416588893459
Chikka Tirupati Temple,Kolar,Pilgrimage,April,Ancient temple,https://images.openai.com/static-rsc-4/6N_ZLT5N9VzSrrFpsgCA3zuGtd6nNOmRSXJr4zCpRxW70I8EOPx6ggymLggJ_W_4c7RQ0lqAvZ5DuynEaykDMz4o4hz-TnPapSJsH7aAuSDgLNSOFWm55WhunO6PuDggL43vKtCRI_Yz_FkC54OyonUuYT_neue2FFBoYR6wb5_xK7sjwWg9KVrARORKWQom?purpose=fullsize,Chikka Tirupati Temple is an ancient temple located in the Kolar district of Karnataka. It is dedicated to Lord Venkateshwara and is known for its religious significance and historical importance. The temple attracts devotees from across the region who come to seek blessings and experience the spiritual ambiance of this unique destination. Chikka Tirupati Temple also offers insights into the rich cultural heritage of Karnataka making it a must-visit spot for those exploring the region.,12.895451,77.8655978
Kolar Gold Fields (KGF),Kolar,Mining,April,Historic gold mining area,https://images.openai.com/static-rsc-4/XrKTc0SGnBhAw4VBaotlIQ4FbXhVu7LbXM4LUcoZln8Qk_3mg5zmOUqd11glzZwB1WLTafBj4ex985s6WYK8lXxWFUHLl_fkn0a9M01uxJoqkKCUxhXfA6OZrCeEBVw2Zzb6uucldVD-m92ZK8qnWtuyxB0f5YhxQrzZ_40Mhs0Q1Of9oK7Z8Et06v6gzxru?purpose=fullsize,Kolar Gold Fields (KGF) is a historic gold mining area located in the Kolar district of Karnataka. It is known for its rich history of gold mining and has been a significant contributor to the region's economy in the past. The area features old mining tunnels and equipment that provide insights into the mining practices of the past. KGF attracts history enthusiasts and those interested in exploring the industrial heritage of Karnataka making it a unique destination for tourists exploring the region.,12.9567565,78.2712598
Kotilingeshwara,Kolar,Pilgrimage,June,Large Shiva linga complex,https://images.herzindagi.info/image/2023/Nov/kotilingeshwara-temple-lord-shiva-temple.jpg,Kotilingeshwara is a significant pilgrimage site located in the Kolar district of Karnataka. It is known for its large Shiva linga complex which features thousands of Shiva lingas of various sizes. The site attracts devotees and tourists alike who come to admire the unique collection of lingas and experience the spiritual ambiance of this unique destination. Kotilingeshwara offers a serene environment for worship and is a popular spot for those seeking spiritual solace in Karnataka.,12.9947328,78.2953284
Mulbagal,Kolar,Historical,July,Temple town,https://dynamic-media-cdn.tripadvisor.com/media/photo-o/0c/df/2a/c1/lrm-export-20160902-230306.jpg?w=500&h=500&s=1,Mulbagal is a historic temple town located in the Kolar district of Karnataka. It is known for its rich history and cultural heritage as it features several ancient temples and historical landmarks. The town attracts history enthusiasts and those interested in exploring Karnataka's rich cultural heritage making it a must-visit destination for tourists exploring the region.,13.1660479,78.3927241

Anegundi,Koppal,Historical,December,Ancient village,https://s7ap1.scene7.com/is/image/incredibleindia/gagan-mahal-hampi-1-attr-hero?qlt=82&ts=1726721919820,Anegundi is an ancient village located in the Koppal district of Karnataka. It is known for its rich history and cultural heritage as it is believed to be one of the oldest inhabited places in India. The village features ancient temples ruins and traditional architecture that provide a glimpse into the region's past. Anegundi attracts history enthusiasts and those interested in exploring Karnataka's rich cultural heritage making it a must-visit destination for tourists exploring the region.,15.3511368,76.4921443
Anjanadri Hills,Koppal,Trekking,February,Hanuman birthplace,https://pbs.twimg.com/media/G7QL6ZybIAAdSWX.jpg,Anjanadri Hills is a significant trekking destination located in the Koppal district of Karnataka. It is believed to be the birthplace of Lord Hanuman a revered deity in Hindu mythology. The hills offer a moderate trek through scenic landscapes and rocky terrain leading to a temple dedicated to Lord Hanuman at the summit. Trekkers can enjoy panoramic views of the surrounding countryside and experience the spiritual ambiance of this sacred site. Anjanadri Hills is especially popular among devotees and adventure seekers looking for a blend of spirituality and nature.,15.3521035,76.4704784
Gavisiddeshwara Mutt,Koppal,Pilgrimage,March,Famous mutt,https://ssmctgavimathkoppal.org/wp-content/uploads/2026/01/1.jpg,Gavisiddeshwara Mutt is a renowned pilgrimage site located in the Koppal district of Karnataka. It is a significant religious institution dedicated to Lord Gavisiddeshwara a form of Lord Shiva. The mutt is known for its spiritual teachings and attracts devotees from across the region. The architecture of the mutt is traditional and serene providing a peaceful environment for worship and meditation. Visitors can experience the rich cultural heritage and spiritual ambiance of Gavisiddeshwara Mutt while exploring its historical significance in the region.,15.34046607821228, 76.16156667990585
Hire Benakal,Koppal,Historical,January,Megalithic site,https://images.news18.com/kannada/uploads/2022/12/Hire-Benakal.jpg,Hire Benakal is a significant megalithic site located in the Koppal district of Karnataka. It is known for its ancient stone structures and burial sites that date back to the Neolithic period. The site offers valuable insights into the prehistoric culture and practices of the region making it a popular destination for history enthusiasts and those interested in exploring Karnataka's rich cultural heritage. Hire Benakal provides visitors with a unique opportunity to connect with the ancient past of the region and is a must-visit spot for tourists exploring Koppal.,15.419407116563034, 76.45260263601712
Huligemma Devi Temple,Koppal,Pilgrimage,April,Famous temple,https://encrypted-tbn0.gstatic.com/images?q=tbn:ANd9GcSpqX2qL8hK_Wj0tudXu4zgVI2SWiDiUlK5Cw&s,Huligemma Devi Temple is a renowned pilgrimage site located in the Koppal district of Karnataka. It is dedicated to Goddess Huligemma a revered deity in the region. The temple attracts devotees from across the area who come to seek blessings and experience the spiritual ambiance of this unique destination. The architecture of the temple is traditional and serene providing a peaceful environment for worship and meditation. Visitors can experience the rich cultural heritage and spiritual significance of Huligemma Devi Temple while exploring its historical importance in the region.,15.30531839561584, 76.3443306840984
Itagi Mahadeva Temple,Koppal,Historical,August,Chalukyan temple,https://i.ytimg.com/vi/g5GwvBoaxYc/maxresdefault.jpg,Itagi Mahadeva Temple is a historic temple located in the Koppal district of Karnataka. It is known for its intricate architecture and historical significance as it dates back to the 11th century during the Chalukyan period. The temple is dedicated to Lord Shiva and features beautiful carvings and sculptures that depict various mythological stories making it a significant destination for history enthusiasts and those interested in exploring Karnataka's rich cultural heritage. Itagi Mahadeva Temple offers visitors a glimpse into the region's past and is a popular spot for those looking to experience the historical landmarks of Koppal.,15.445107386218783, 75.9675051576801
Kanakagiri,Koppal,Pilgrimage,September,Ancient temple town,https://encrypted-tbn0.gstatic.com/images?q=tbn:ANd9GcSJzOJXZPVVTqRbcqYfCoMHKmLl9oD4MpMBHA&s,Kanakagiri is an ancient temple town located in the Koppal district of Karnataka. It is known for its religious significance and historical importance as it features several ancient temples and historical landmarks. The town attracts devotees and tourists alike who come to seek blessings and experience the spiritual ambiance of this unique destination while also providing insights into the rich cultural heritage of Karnataka.,15.5696792,76.4189879
Kinnal,Koppal,Handicrafts,October,Traditional wooden toys,https://encrypted-tbn0.gstatic.com/images?q=tbn:ANd9GcSVLaSPBBMaAxU0UajYYIcNBDq3-yXHNSsNzw&s,Kinnal Kale is a traditional handicraft destination located in the Koppal district of Karnataka. It is known for its unique wooden toys and crafts that are handcrafted by local artisans. The town has a rich history of toy making and is famous for its intricate designs and vibrant colors. Visitors can explore the workshops and purchase authentic Kinnal toys as souvenirs while also supporting the local artisans and preserving this traditional craft.,15.4426849,76.1415892
Koppal Fort,Koppal,Forts,November,Historic hill fort,https://media.assettype.com/prajavani%2Fimport%2Fsites%2Fpv%2Ffiles%2Farticle_images%2F2022%2F08%2F12%2Ffile7m9e82nzr4p1kon0u4px1660312104.jpg?w=undefined&auto=format%2Ccompress&fit=max&q=70,Koppal Fort is a historic hill fort located in the Koppal district of Karnataka. It is known for its impressive architecture and strategic location offering panoramic views of the surrounding landscape. The fort has a rich history and has witnessed several battles and rulers over the centuries making it a significant destination for history enthusiasts looking to explore the cultural heritage of Karnataka.,15.3395766,76.1480211
Munirabad Dam,Koppal,Dam,June,Reservoir destination,https://images.jdmagicbox.com/v2/comp/koppal/y3/9999p8534.8534.230910122024.p2y3/catalogue/tungabhadra-damn-we-point-munirabad-koppal-tourist-attraction-1nq28jccq2.jpg,Munirabad Dam is a scenic reservoir destination located in the Koppal district of Karnataka. It is known for its tranquil environment and beautiful surroundings making it a popular destination for nature lovers and those looking to experience the natural beauty of the region. The dam offers opportunities for boating and picnicking providing a perfect setting for relaxation and enjoying nature in Karnataka.,15.2666153,76.3299197
Navabrindavana,Koppal,Pilgrimage,July,Sacred island,https://media-cdn.tripadvisor.com/media/photo-s/09/34/46/e5/navabrindavanam.jpg,Navabrindavana is a sacred island located in the Koppal district of Karnataka. It is known for its religious significance as it is believed to be the final resting place of nine revered saints in the Dvaita tradition of Hinduism. The island features a temple and attracts devotees and tourists alike who come to seek blessings and experience the spiritual ambiance of this unique destination. Navabrindavana offers a serene environment for worship and is a popular spot for those seeking spiritual solace in Karnataka.,15.351887403690535, 76.49518696654401
Pampa Sarovar,Koppal,Pilgrimage,January,Sacred lake,https://cf-images.assettype.com/tnm%2Fimport%2Fsites%2Fdefault%2Ffiles%2Fpampasarovara-anegunditourism-susheelaair-240622-1200.jpg,Pampa Sarovar is a sacred lake located in the Koppal district of Karnataka. It is known for its religious significance as it is believed to be the place where Lord Rama met Shabari during his exile. The lake is surrounded by lush greenery and offers a serene environment for visitors to experience the spiritual ambiance of this unique destination. Pampa Sarovar attracts devotees and tourists alike who come to admire the natural beauty and cultural significance of this sacred site.,15.353922714203934, 76.4773321653564
Pampavana,Koppal,Garden,May,Riverside garden,https://encrypted-tbn0.gstatic.com/images?q=tbn:ANd9GcRUtAUT9P0HZPlKcAR-3jWtJ-RSC6cxZUdE6A&s,Pampavana is a serene riverside garden located in the Koppal district of Karnataka. It is known for its lush greenery and tranquil environment making it a popular destination for nature lovers and those looking to experience the beauty of the region's natural landscapes. Pampavana offers opportunities for leisurely walks and picnics providing a perfect setting for relaxation and enjoying nature in Karnataka.,15.2759902,76.322522
Sanapur Lake,Koppal,Nature,November,Scenic lake,https://images.openai.com/static-rsc-4/H-4klILvUCLEKFCgdmS_wm_hvjcN4HviAfri6r4DQA1n1SIFG2M-969hvGm170rxcIseIuLayIflHWM_ewIlXrexlQNmqWCk4Nsomut_gj1ukGLnYMMvqP4HSaJwrGbmWOQhHiR56sPDRRjKmD4LUiSSxEerjq5K_igTX1NSdMMCUNWU70vZevIJUPfVWSJh?purpose=fullsize,Sanapur Lake is a scenic lake located in the Koppal district of Karnataka. It is known for its tranquil environment and beautiful surroundings making it a popular destination for nature lovers and those looking to experience the natural beauty of the region. The lake offers opportunities for boating and picnicking providing a perfect setting for relaxation and enjoying nature in Karnataka.,15.358935979053097, 76.43125150416041

Bheemeswari,Mandya,Adventure,January,Fishing and rafting,https://dq1q7qkthxkc0.cloudfront.net/thumbnails/411x274/PackageMedia/abab315f-0c71-46e8-b4c1-cc48c3602f99.webp,Bheemeswari is an adventure destination located in the Mandya district of Karnataka. It is known for its fishing and rafting experiences on the Cauvery River. The area offers a serene environment for visitors to enjoy nature and engage in thrilling water activities making it a popular destination for adventure enthusiasts and nature lovers visiting the region.,12.312035820832516, 77.27741402646616
Hemagiri Falls,Mandya,Waterfall,September,Scenic waterfall,https://content.jdmagicbox.com/v2/comp/mandya/n5/9999p8232.8232.230224195815.l6n5/catalogue/hemagiri-waterfalls-bandihole-mandya-tourist-attraction-tsan1r7dnt.jpg,Hemagiri Falls is a scenic waterfall located in the Mandya district of Karnataka. It is surrounded by lush greenery and offers a tranquil environment for visitors to enjoy nature. The falls are especially impressive during the monsoon season when the water flow is at its peak. Hemagiri Falls is a popular destination for nature lovers and photographers looking to capture the beauty of this natural wonder.,12.659552120235805, 76.41132462038084
Karighatta,Mandya,Pilgrimage,June,Hill temple,https://encrypted-tbn0.gstatic.com/images?q=tbn:ANd9GcR2CDOA59VcBl8p3G7-FJZ8gpiZo5PcLAh0rA&s,Karighatta is a significant pilgrimage site located in the Mandya district of Karnataka. It is known for its hill temple dedicated to Lord Vishnu and attracts devotees from across the region who come to seek blessings and experience the spiritual ambiance of this unique destination. The temple is situated on a hill offering stunning views of the surrounding landscape making it a popular spot for those looking to combine spirituality with natural beauty in Karnataka.,12.4250936,76.7196002
Kokkare Bellur,Mandya,Wildlife,October,Bird conservation village,https://encrypted-tbn0.gstatic.com/images?q=tbn:ANd9GcRwJRcf9BKkBjj904OFJo5uajYsWwJMaP6tnQ&s,Kokkare Bellur is a unique bird conservation village located in the Mandya district of Karnataka. It is known for its efforts in protecting and conserving various species of birds particularly the painted stork and the spot-billed pelican. The village offers visitors a chance to observe these beautiful birds in their natural habitat and learn about the importance of wildlife conservation. Kokkare Bellur provides a serene environment for nature lovers and bird enthusiasts looking to experience the beauty of Karnataka's avian diversity.,12.5097738,77.0883259
